date,week,tweets,processed,nltk-compound,nltk-pos,nltk-neg,tb-polarity,tb-subjectivity
2020-09-14,3," Immediately dumping the token they just mined doesn’t imply being a good Samaritan.

Thinking of LP as speculators is pretty much the same as thinking of Bitcoin miners as traders. Some are, some aren’t.","Immediately dumping the token they just mined doesn’t imply being a good Samaritan.Thinking of LP as speculators is pretty much the same as thinking of Bitcoin miners as traders. Some are, some aren’t.",0.5859,0.159,0.06,0.2875,0.48125
2020-09-19,3,"     Good catch, the CEO of Swerve is ready to offer you your job back, just need a signature from the CEO of Bitcoin.","Good catch, the CEO of Swerve is ready to offer you your job back, just need a signature from the CEO of Bitcoin.",0.6597,0.213,0.0,0.3,0.3666666666666667
2020-09-22,4," defi means i buy low and dump on everyone

bitcoin is defi

see, easy","defi means i buy low and dump on everyonebitcoin is defisee, easy",-0.2023,0.165,0.267,0.21666666666666667,0.5666666666666667
2020-09-23,4," TBH, recommending BTC to friends and family is exactly how you end up with neither.","TBH, recommending BTC to friends and family is exactly how you end up with neither.",0.4767,0.181,0.0,0.25,0.25
2020-09-23,4,"  True, because I definitely said, that it was me who recommended BTC to them.","True, because I definitely said, that it was me who recommended BTC to them.",0.743,0.422,0.0,0.175,0.575
2020-10-06,6," I think that main beneficiaries of this event will be other stablecoins because USDT is so entangled into the whole ecosystem that its demise will lead to a devastating systemic catastrophe, affecting all volatile assets, including BTC.","I think that main beneficiaries of this event will be other stablecoins because USDT is so entangled into the whole ecosystem that its demise will lead to a devastating systemic catastrophe, affecting all volatile assets, including BTC.",-0.7351,0.102,0.197,-0.18958333333333333,0.5270833333333333
2020-10-14,7," Bitcoin is a salty maxis generation machine and Ethereum is a defi lambo ponzi generation machine. 

Just my 2 cents, ma’am.","Bitcoin is a salty maxis generation machine and Ethereum is a defi lambo ponzi generation machine. Just my 2 cents, ma’am.",0.0,0.0,0.0,0.0,0.0
2020-10-19,8,"   It is a definite thing, but it entirely depends on a very democratic consensus. The moment the consensus decides there is 100m BTC now, the definite thing changes.","It is a definite thing, but it entirely depends on a very democratic consensus. The moment the consensus decides there is 100m BTC now, the definite thing changes.",0.4939,0.149,0.0,0.05,0.48125
2020-10-20,8,"👎 bitcoin vs alts
👌profiting from both",👎 bitcoin vs alts👌profiting from both,0.0,0.0,0.0,0.0,0.0
2020-10-20,8," 300x BTC long, target $20k, got it, funding secured","300x BTC long, target $20k, got it, funding secured",0.4019,0.252,0.0,-0.05,0.4
2020-10-20,8,"Feeling comfy in USDC. 

Bitcoin breaks $12k, good, some stablecoin liq will be out of my farms, chasing pump, more apy for me.

Dumps massively, also good. Will start sliding in some fav tokens.

Either way not diving into this retard market until we’re way past the elections.","Feeling comfy in USDC. Bitcoin breaks $12k, good, some stablecoin liq will be out of my farms, chasing pump, more apy for me.Dumps massively, also good. Will start sliding in some fav tokens.Either way not diving into this retard market until we’re way past the elections.",0.4548,0.176,0.125,0.12499999999999999,0.6583333333333333
2020-10-21,8,"Incredible demand for USDT driven by the BTC pump has soaked up USDT liquidity both on  and .

At the moment, Curve's USDT pool yields 75-187% APY. https://t.co/0wROGSwljb","Incredible demand for USDT driven by the BTC pump has soaked up USDT liquidity both on  and .At the moment, Curve's USDT pool yields 75-187% APY.",-0.128,0.0,0.055,0.9,0.9
2020-10-21,8, It will get better until it gets much worse when BTC obliterates alts on the next leg up,It will get better until it gets much worse when BTC obliterates alts on the next leg up,-0.0516,0.132,0.141,0.033333333333333326,0.3666666666666667
2020-10-22,8,"Happy traders means optimistic traders. 

Optimistic traders means we have a chance to drag that farmer party a little longer.

As a cash gang I sincerely wish you punters amazing returns on your bets.

Go BTC, rip it baby.","Happy traders means optimistic traders. Optimistic traders means we have a chance to drag that farmer party a little longer.As a cash gang I sincerely wish you punters amazing returns on your bets.Go BTC, rip it baby.",0.9623,0.448,0.038,0.32250000000000006,0.5941666666666666
2020-10-22,8,  I wonder if alts will follow when BTC *really* takes off. Like ripping through 20k.,I wonder if alts will follow when BTC *really* takes off. Like ripping through 20k.,0.3612,0.161,0.0,0.2,0.2
2020-10-22,8,"  Who knows, Bitcoin is full of surprises. I mean, most people expected alts to retrace yesterday when BTC drew that 1k candle.","Who knows, Bitcoin is full of surprises. I mean, most people expected alts to retrace yesterday when BTC drew that 1k candle.",0.2263,0.087,0.0,0.109375,0.534375
2020-10-27,9,"“Bitcoin surging again”
“The decoupling”
“ETHBTC to zero”

+1.5%",“Bitcoin surging again”“The decoupling”“ETHBTC to zero”+1.5%,0.0,0.0,0.0,0.0,0.0
2020-10-28,9,"  He stopped having fun because his btc bag made him rich. 

I'd quit too.",He stopped having fun because his btc bag made him rich. I'd quit too.,0.7184,0.348,0.096,0.3375,0.475
2020-10-29,9," Flat till max pain due to uncertainty, all in bitcoin immediately after.","Flat till max pain due to uncertainty, all in bitcoin immediately after.",-0.6908,0.0,0.363,-0.075,0.25
2020-11-09,11, direct injections of pure bitcoin ftw,direct injections of pure bitcoin ftw,0.4588,0.375,0.0,0.15714285714285714,0.45
2020-11-11,11, The BTC vs ETH people either troll - which is fine and fun - or still can’t see the forest behind the trees.,The BTC vs ETH people either troll - which is fine and fun - or still can’t see the forest behind the trees.,0.6249,0.212,0.0,0.10555555555555556,0.4666666666666666
2020-11-21,12," Have a good trip!

Although, no way bitcoin ath holds for two weeks unless there will be some sort of macro shenanigans","Have a good trip!Although, no way bitcoin ath holds for two weeks unless there will be some sort of macro shenanigans",0.2481,0.131,0.09,0.875,0.6000000000000001
2020-11-21,12," What else is spectacular as well is the fact that according to  reports, the amount of bitcoin bought now is order of magnitude bigger than what it's used to be several months ago:

Nov, 19: 19,351
Nov, 10: 15,264
Nov, 02: 15,907

All while we approach ATH.","What else is spectacular as well is the fact that according to  reports, the amount of bitcoin bought now is order of magnitude bigger than what it's used to be several months ago:Nov, 19: 19,351Nov, 10: 15,264Nov, 02: 15,907All while we approach ATH.",0.2732,0.044,0.0,0.19999999999999998,0.4666666666666666
2020-11-21,12, if i were to shill bitcoin i'd say that bitcoin is a way for the small to fuck the big,if i were to shill bitcoin i'd say that bitcoin is a way for the small to fuck the big,-0.5423,0.0,0.171,-0.21666666666666667,0.3666666666666667
2020-11-28,13," Sometimes I think that people are starting to believe the narrative they are trying to sell.

Bitcoin isn’t a hedge against war/dysfunction/society. It’s a risk-on asset that gets sold at the first sight of risk.

80% of my NW is in Bitcoin now but some takes are just cringe.",Sometimes I think that people are starting to believe the narrative they are trying to sell.Bitcoin isn’t a hedge against war/dysfunction/society. It’s a risk-on asset that gets sold at the first sight of risk.80% of my NW is in Bitcoin now but some takes are just cringe.,0.0516,0.037,0.033,0.125,0.21666666666666667
2020-11-30,14,BTC on Binance hit ATH https://t.co/vmkpwhjmdW,BTC on Binance hit ATH,0.0,0.0,0.0,0.0,0.0
2020-12-07,15, not sure if a bitcoin reference but i feel attacked,not sure if a bitcoin reference but i feel attacked,-0.6685,0.0,0.477,-0.25,0.8888888888888888
2020-12-16,16,"not to spoil the party, but who cares about 6% gain in bitcoin when you can have 9% yields daily

if you know, you know

ø","not to spoil the party, but who cares about 6% gain in bitcoin when you can have 9% yields dailyif you know, you knowø",0.8873,0.322,0.0,0.0,0.0
2020-12-17,16,"pro tip: when you decide to sell your btc, make sure you exited to usdc as you will end up in $esd farm anyway","pro tip: when you decide to sell your btc, make sure you exited to usdc as you will end up in $esd farm anyway",0.3182,0.091,0.0,0.5,0.8888888888888888
2021-01-07,18," TBH it reminds me of huge unlocks in $DSD everyone was afraid of.

We know what happened then. The price skyrocketed. 

Sam is right, highly anticipated negative - and positive, just look back to the btc last halving - events turn out to be nothing at best, short-term.","TBH it reminds me of huge unlocks in $DSD everyone was afraid of.We know what happened then. The price skyrocketed. Sam is right, highly anticipated negative - and positive, just look back to the btc last halving - events turn out to be nothing at best, short-term.",-0.3498,0.107,0.133,0.13033189033189033,0.46531505531505535
2021-01-11,19,"just btfd with &gt; $1m $btc

now back to crunching data on $dsd and $esd",just btfd with  $1m $btcnow back to crunching data on $dsd and $esd,0.0,0.0,0.0,0.0,0.0
2021-01-11,19," Fiat investors 'should be prepared to lose all their money,' bitcoiners warn","Fiat investors 'should be prepared to lose all their money,' bitcoiners warn",-0.296,0.127,0.273,0.0,0.0
2021-01-16,19,"The GBTC train is unstoppable.

With every BTC dip they double down on acquisitions.

Time to be leverage short, beras. We need fresh blood to break that 40k ceiling. https://t.co/HEw3W0kKNg","The GBTC train is unstoppable.With every BTC dip they double down on acquisitions.Time to be leverage short, beras. We need fresh blood to break that 40k ceiling.",0.128,0.072,0.056,0.0361111111111111,0.27222222222222225
2021-01-17,19,"in case it's not obvious, we're only getting 20k $btc if macro shits the bed

we're in full blown consolidation, scrap that 20k bera charts and chill","in case it's not obvious, we're only getting 20k $btc if macro shits the bedwe're in full blown consolidation, scrap that 20k bera charts and chill",-0.4767,0.0,0.107,0.11666666666666665,0.6833333333333332
2021-01-17,19,"  No, since i lost about 2 btc on bitmex back in 2018, i never do any leveraged play","No, since i lost about 2 btc on bitmex back in 2018, i never do any leveraged play",-0.2732,0.127,0.238,0.0,0.0
2021-01-18,20," Sir, Tether is really important for fudding Bitcoin when one has missed the pump but still wants to enter the game.","Sir, Tether is really important for fudding Bitcoin when one has missed the pump but still wants to enter the game.",-0.0138,0.07,0.072,0.0666666666666667,0.5
2021-01-18,20," your donation to the upcoming btc pump is greatly appreciated, sir","your donation to the upcoming btc pump is greatly appreciated, sir",0.5563,0.264,0.0,0.2,0.1
2021-01-18,20,Grayscale casually bought 16k BTC in 24h. This week is going to be spectacular. https://t.co/nr9Zgn5awZ,Grayscale casually bought 16k BTC in 24h. This week is going to be spectacular.,0.1779,0.108,0.0,0.04999999999999993,0.8833333333333333
2021-01-21,20,"Woke up to the feed filled with desperation on BTC.

Just wanted to remind you that while retail is scared shitless, the  train keeps chugging along.

+8762 BTC acquired in the last 24h.

HFSP. https://t.co/alijsw3zfl","Woke up to the feed filled with desperation on BTC.Just wanted to remind you that while retail is scared shitless, the  train keeps chugging along.+8762 BTC acquired in the last 24h.HFSP.",-0.7096,0.0,0.152,0.2,0.48333333333333334
2021-01-22,20, I'm too focused on BTC right now but will happily tweet about them when I have one,I'm too focused on BTC right now but will happily tweet about them when I have one,0.7717,0.324,0.0,0.5428571428571429,0.7678571428571428
2021-01-23,20,"If I had to pick a single $BTC chart to track daily, my all-time favourite would be the Illiquid Supply Change chart.

It tracks inflows and outflows of bitcoin to hodler addresses.

As you can see it's at ATH the last two weeks.

We're in huge consolidation. https://t.co/2jmPooadPz","If I had to pick a single $BTC chart to track daily, my all-time favourite would be the Illiquid Supply Change chart.It tracks inflows and outflows of bitcoin to hodler addresses.As you can see it's at ATH the last two weeks.We're in huge consolidation.",0.3182,0.049,0.0,0.08214285714285716,0.29523809523809524
2021-01-25,21,"basically, the name of the game now is to timely exit alts and move everything to $btc before corn starts painting green $1k dildos again","basically, the name of the game now is to timely exit alts and move everything to $btc before corn starts painting green $1k dildos again",0.0,0.0,0.0,-0.30000000000000004,0.35
2021-01-26,21,"My feed is filled with FUD on #Bitcoin topping and the repeat of the 2017 top scenario.

Well, on-chain data begs to differ.

Here's what illiquid supply dynamics looked like at the former top and what it paints now.

HODLers were selling then but they're accumulating this time. https://t.co/eA6g91tNaG","My feed is filled with FUD on #Bitcoin topping and the repeat of the 2017 top scenario.Well, on-chain data begs to differ.Here's what illiquid supply dynamics looked like at the former top and what it paints now.HODLers were selling then but they're accumulating this time.",0.4085,0.146,0.036,0.35,0.475
2021-01-26,21," vanilla btc is like pure vodka - it's drunk only by fanatics and russians

always be wrappin'",vanilla btc is like pure vodka - it's drunk only by fanatics and russiansalways be wrappin',0.0258,0.132,0.127,-0.09523809523809523,0.8333333333333334
2021-01-28,21,"The great #Bitcoin transfer of wealth continues.

Left: liquid (outflows / inflows ≥ 0.25) wallets btc change
Right: illiquid (outflows / inflows &lt; 0.25) wallets btc change

Traders, degens, and random punters keep selling to hodlers.

(updated data)
Source:  https://t.co/Ia6O9ZAajn","The great #Bitcoin transfer of wealth continues.Left: liquid (outflows / inflows ≥ 0.25) wallets btc changeRight: illiquid (outflows / inflows &lt; 0.25) wallets btc changeTraders, degens, and random punters keep selling to hodlers.(updated data)Source:",0.8074,0.173,0.0,0.14642857142857146,0.4464285714285714
2021-01-28,21," #bitcoin will have fireworks either in feb or march

too many stars are lining up",#bitcoin will have fireworks either in feb or marchtoo many stars are lining up,0.0,0.0,0.0,0.5,0.5
2021-01-29,21,"Unfortunately, if Coinbase is out of #bitcoin it doesn't look like it on charts in this very moment.

The Coinbase premium is negative which suggests that there's selling pressure, if anything.

Source:  https://t.co/dhtdk36dXt https://t.co/hn2CX4E2wp","Unfortunately, if Coinbase is out of #bitcoin it doesn't look like it on charts in this very moment.The Coinbase premium is negative which suggests that there's selling pressure, if anything.Source:",-0.8559,0.0,0.258,-0.19999999999999998,0.5666666666666668
2021-01-30,21,"Some weekend alpha.

$TBTC is experiencing supply side crisis as its prohibitively difficult to get it organically in size.

That’s why its  pool is  unbalanced. https://t.co/ShU5JwXr1w",Some weekend alpha.$TBTC is experiencing supply side crisis as its prohibitively difficult to get it organically in size.That’s why its  pool is  unbalanced.,-0.765,0.0,0.216,-0.5,1.0
2021-01-30,21,"On the other hand, this TBTC pool’s token has the biggest APY of all other Curve pools in  https://t.co/EpP95mGATc","On the other hand, this TBTC pool’s token has the biggest APY of all other Curve pools in",0.4939,0.151,0.0,-0.125,0.375
2021-01-30,21,"This setup gives the somewhat safe opportunity of entering the TBTC pool with sBTC, renBTC, or wBTC to enjoy not only the greater yield but also some arbitrage opportunity as this yield can drive the TBTC pool’s imbalance even further.","This setup gives the somewhat safe opportunity of entering the TBTC pool with sBTC, renBTC, or wBTC to enjoy not only the greater yield but also some arbitrage opportunity as this yield can drive the TBTC pool’s imbalance even further.",0.75,0.197,0.034,0.27999999999999997,0.6
2021-01-31,21," Bullish on BTC but there's an increasing chance that de-grossing and the subsequent sell-off will take crypto down with it.

Cash gang for a week.

I mean it's 60% APY, ser.","Bullish on BTC but there's an increasing chance that de-grossing and the subsequent sell-off will take crypto down with it.Cash gang for a week.I mean it's 60% APY, ser.",0.3612,0.082,0.0,-0.15601851851851853,0.3421296296296297
2021-02-01,22,"Possible reasons:
- Non-accredited investors aren't eager to buy their publicly offered $GBTC at this price
- Increased selling from accredited investors realizing their premium
- Increased competition driving the demand elsewhere https://t.co/bmiIrgqca1",Possible reasons:- Non-accredited investors aren't eager to buy their publicly offered $GBTC at this price- Increased selling from accredited investors realizing their premium- Increased competition driving the demand elsewhere,0.1506,0.124,0.107,0.0,0.5333333333333333
2021-02-01,22," yup, also no more vacuum cleaner collecting btc from the market","yup, also no more vacuum cleaner collecting btc from the market",-0.0571,0.15,0.167,-0.12916666666666668,0.25
2021-02-01,22, imo the main bear case for btc is the corn hugging snp500 going down the abyss,imo the main bear case for btc is the corn hugging snp500 going down the abyss,0.4215,0.157,0.0,0.005555555555555536,0.3111111111111111
2021-02-04,22,"Watch this one closely.

No matter how bullish markets look it won't matter if $DXY continues its uptrend.

Still bullish on Bitcoin and DeFi but the macro shouldn't be ignored. https://t.co/XMJlNOlNGP",Watch this one closely.No matter how bullish markets look it won't matter if $DXY continues its uptrend.Still bullish on Bitcoin and DeFi but the macro shouldn't be ignored.,0.2366,0.137,0.048,0.0,0.0
2021-02-04,22,"  bitcoin and defi are risk-on assets and those tend to be first in line to be sold when trad markets are tanking.

crypto still depends on the macro, but some people tend to forget it when everything is pumping.","bitcoin and defi are risk-on assets and those tend to be first in line to be sold when trad markets are tanking.crypto still depends on the macro, but some people tend to forget it when everything is pumping.",-0.25,0.033,0.058,0.25,0.3333333333333333
2021-02-05,22,"DXY annihilated
VIX obliterated
BTC MPI below 2
BTC holders inflow ripping
Stablecoin CEX inflow rising
1000 BTC addresses upticking

Honestly, I’m out of bearish ideas at this point.

As usual, institution/companies are pouring in, retail is next.

Risk on, #Bitcoin","DXY annihilatedVIX obliteratedBTC MPI below 2BTC holders inflow rippingStablecoin CEX inflow rising1000 BTC addresses uptickingHonestly, I’m out of bearish ideas at this point.As usual, institution/companies are pouring in, retail is next.Risk on, #Bitcoin",-0.296,0.066,0.115,0.11666666666666665,0.3833333333333333
2021-02-06,22,"We all know the rotation to BTC is coming and yet some of you are grasping to defi and buying this dip.

Why? https://t.co/KMtljS659K",We all know the rotation to BTC is coming and yet some of you are grasping to defi and buying this dip.Why?,0.0,0.0,0.0,0.0,0.0
2021-02-06,22, If you mean I’m wrong about BTC as I were about DSD then I agree https://t.co/DPqvX3K4OX,If you mean I’m wrong about BTC as I were about DSD then I agree,-0.1531,0.142,0.176,-0.40625,0.79375
2021-02-06,22," BTC -&gt; ETH -&gt; DeFi -&gt; BTC

I didn't make the rules. No, sir

But yeah, dips are generally for buying","BTC - ETH - DeFi - BTCI didn't make the rules. No, sirBut yeah, dips are generally for buying",0.0,0.098,0.098,0.05000000000000002,0.5
2021-02-06,22," Other factors possibly contributing to decreasing supply on CEXes:
1. More usable OTC markets
2. Proliferation of tokenized BTC in DeFi
3. More opportunities for CEXes to deploy their BTC elsewhere

Agree with the narrative, though.","Other factors possibly contributing to decreasing supply on CEXes:1. More usable OTC markets2. Proliferation of tokenized BTC in DeFi3. More opportunities for CEXes to deploy their BTC elsewhereAgree with the narrative, though.",0.659,0.137,0.0,0.21875,0.59375
2021-02-06,22,"  There are many flavours of tokenized BTC and I'm not sure they are represented on this chart.

Probably  can clarify it.",There are many flavours of tokenized BTC and I'm not sure they are represented on this chart.Probably  can clarify it.,-0.2411,0.0,0.089,0.125,0.6944444444444444
2021-02-07,22,"Nothing builds relationships like hodling an underwater BTC position together with your partner.

Highly recommended.",Nothing builds relationships like hodling an underwater BTC position together with your partner.Highly recommended.,-0.0044,0.122,0.123,0.16,0.5399999999999999
2021-02-08,23,"Tesla has bought $1.5b worth of #Bitcoin according to the SEC filing.

Welcome onboard, Elon.","Tesla has bought $1.5b worth of #Bitcoin according to the SEC filing.Welcome onboard, Elon.",0.5994,0.274,0.0,0.3333333333333333,0.5333333333333333
2021-02-08,23,$TSLA $BTC https://t.co/KVijN2vGQv,$TSLA $BTC,0.0,0.0,0.0,0.0,0.0
2021-02-08,23," This man is an asset. The day he buys BTC, I'm selling like there's no tomorrow.","This man is an asset. The day he buys BTC, I'm selling like there's no tomorrow.",0.4215,0.248,0.109,0.0,0.0
2021-02-08,23,"Not gonna lie, Elon and Tesla today gave me the same feeling as Paul Tudor Jones did back in 2020.

PTJ validated BTC for funds.
Elon just did it for public companies.

I'm watching on-chain like a hawk. https://t.co/5jMBH38k52","Not gonna lie, Elon and Tesla today gave me the same feeling as Paul Tudor Jones did back in 2020.PTJ validated BTC for funds.Elon just did it for public companies.I'm watching on-chain like a hawk.",0.5994,0.144,0.0,0.0,0.06388888888888888
2021-02-09,23,"Love it, the dipping #Bitcoin price is met with sustained stablecoin inflow on exchanges.

BTFD, on-chain representation. https://t.co/wVgrQ8vyLh","Love it, the dipping #Bitcoin price is met with sustained stablecoin inflow on exchanges.BTFD, on-chain representation.",0.6369,0.198,0.0,0.5,0.6
2021-02-09,23, Well you can’t sell GBTC immeadiately when buying via private placement. There is a 6 month lock up period.,Well you can’t sell GBTC immeadiately when buying via private placement. There is a 6 month lock up period.,0.2732,0.116,0.0,0.0,0.375
2021-02-09,23," You can buy Bitcoin but be publicly bearish for clout and engagement.

This strategy worked wonderful for ",You can buy Bitcoin but be publicly bearish for clout and engagement.This strategy worked wonderful for,0.8765,0.376,0.0,0.5,0.5333333333333333
2021-02-09,23,"Noticed that I have stopped tracking #Bitcoin price after Tesla’s coming out.

The upcoming stream of corporations matters much more than the price the next two months.

Also, the on-chain data associated with it. 

Bitcoin has been re-rated but you still can hop on the train.","Noticed that I have stopped tracking #Bitcoin price after Tesla’s coming out.The upcoming stream of corporations matters much more than the price the next two months.Also, the on-chain data associated with it. Bitcoin has been re-rated but you still can hop on the train.",-0.1027,0.023,0.032,0.25,0.25
2021-02-10,23," shhh sir, *everything* is about bitcoin","shhh sir, *everything* is about bitcoin",0.0,0.0,0.0,0.0,0.0
2021-02-10,23," except bitcoin, it's about gf","except bitcoin, it's about gf",0.0,0.0,0.0,0.0,0.0
2021-02-10,23," Tesla having bought bitcoin may and probably will trigger some public companies to do the same.

When they do, the price will take care of itself.","Tesla having bought bitcoin may and probably will trigger some public companies to do the same.When they do, the price will take care of itself.",0.4939,0.113,0.0,0.0,0.09583333333333333
2021-02-11,23,"Coinbase Premium reached almost $500 two hours ago.

That's even bigger than the FOMO of Tesla #Bitcoin news.

Meanwhile, I see no significant news yet.

Something's coming? https://t.co/T47c2TrmfQ","Coinbase Premium reached almost $500 two hours ago.That's even bigger than the FOMO of Tesla #Bitcoin news.Meanwhile, I see no significant news yet.Something's coming?",0.0,0.109,0.075,-0.09375,0.6875
2021-02-11,23,He won’t keep his mouth shut about #Bitcoin https://t.co/xxUDXXcr0s,He won’t keep his mouth shut about #Bitcoin,0.0,0.0,0.0,0.0,0.0
2021-02-11,23," They will rotate only if there is explosive BTC growth.

Otherwise, altcoins are supported by they own set of narratives and public figures.","They will rotate only if there is explosive BTC growth.Otherwise, altcoins are supported by they own set of narratives and public figures.",0.5994,0.189,0.0,0.19999999999999998,0.688888888888889
2021-02-12,23,"Any institution, company, and individual that holds any of the ETF below or plain $TSLA, holds #Bitcoin as well.

Tesla has pulled the ultimate trojan horse.

Let's welcome Warren Buffett and Swiss National Bank.

Holding TSLA? You are long $BTC. https://t.co/ijYINzHEAm","Any institution, company, and individual that holds any of the ETF below or plain $TSLA, holds #Bitcoin as well.Tesla has pulled the ultimate trojan horse.Let's welcome Warren Buffett and Swiss National Bank.Holding TSLA? You are long $BTC.",0.6249,0.116,0.0,0.10714285714285714,0.6114285714285714
