date,week,tweets,processed,nltk-compound,nltk-pos,nltk-neg,tb-polarity,tb-subjectivity
2021-03-21,28,  Depends on the severity of the dump. Whatever maxis say BTC is still a risk-on asset.,Depends on the severity of the dump. Whatever maxis say BTC is still a risk-on asset.,-0.0258,0.138,0.144,0.0,0.0
2021-03-21,28,"$138m #Bitcoin longs liquidated in 10 minutes.

People never learn. https://t.co/2WMCvW9i0L",$138m #Bitcoin longs liquidated in 10 minutes.People never learn.,0.0,0.0,0.0,0.0,0.0
2021-03-22,29,Three month long #Bitcoin long-term holders selling pressure is fading. https://t.co/aTiq4Alve3,Three month long #Bitcoin long-term holders selling pressure is fading.,-0.296,0.0,0.18,-0.05,0.4
2021-03-23,29,"9,077 #Bitcoin withdrawn from Coinbase in a single tx. https://t.co/TCHhHIQ1Ko","9,077 #Bitcoin withdrawn from Coinbase in a single tx.",0.3612,0.238,0.0,-0.07142857142857142,0.21428571428571427
2021-03-24,29,Bitcoiners shilling Tesla cars to their friends will take us to the moon. https://t.co/Q05CIiFttV,Bitcoiners shilling Tesla cars to their friends will take us to the moon.,0.4767,0.193,0.0,0.0,0.0
2021-03-24,29,"Strong holders are increasing their positions.

Another sharp increase of #Bitcoin in the illiquid wallets. https://t.co/v2pwQLRc4Q",Strong holders are increasing their positions.Another sharp increase of #Bitcoin in the illiquid wallets.,0.6808,0.286,0.0,0.15416666666666665,0.7416666666666667
2021-03-24,29," Papa Musk's hands are made of diamond.

He will hold your Bitcoin to Mars.",Papa Musk's hands are made of diamond.He will hold your Bitcoin to Mars.,0.34,0.156,0.0,0.0,0.0
2021-03-24,29,"  Elon Musk wants Bitcoin, exactly.","Elon Musk wants Bitcoin, exactly.",0.0,0.0,0.0,0.225,0.175
2021-03-24,29," bitcoiners are natural contrarians

they bashed ethereum so much they got bullish on it",bitcoiners are natural contrariansthey bashed ethereum so much they got bullish on it,0.3612,0.161,0.0,0.15000000000000002,0.30000000000000004
2021-03-24,29,"$47m of #Bitcoin longs got liquidated in 10 minutes.

Don't play with leverage, kids.

Elon'd again. https://t.co/4d4B3xowVN","$47m of #Bitcoin longs got liquidated in 10 minutes.Don't play with leverage, kids.Elon'd again.",-0.2584,0.0,0.113,0.0,0.0
2021-03-25,29,"215,331 #Bitcoin moved to strong HODLers wallets yesterday.

This is the 3-year ATH.

Interesting. https://t.co/IxbSQziT2z","215,331 #Bitcoin moved to strong HODLers wallets yesterday.This is the 3-year ATH.Interesting.",0.7184,0.316,0.0,0.4666666666666667,0.6166666666666667
2021-03-25,29, Bitcoin is the ultimate Plan B,Bitcoin is the ultimate Plan B,0.0,0.0,0.0,0.0,1.0
2021-03-25,29,Be buying Bitcoin.,Be buying Bitcoin.,0.0,0.0,0.0,0.0,0.0
2021-03-25,29,"Grayscale Premium collapsed to -14.34%

Increased competition in the #Bitcoin ETF space leaves less chances for GBTC to make the underlying BTC withdrawable. https://t.co/srSYLNU1xk",Grayscale Premium collapsed to -14.34%Increased competition in the #Bitcoin ETF space leaves less chances for GBTC to make the underlying BTC withdrawable.,0.1298,0.135,0.079,-0.16666666666666666,0.06666666666666667
2021-03-25,29,"  Unlike ETF, the underlying bitcoins of the GBTC fund can not be redeemed.

That’s why there is the discount.","Unlike ETF, the underlying bitcoins of the GBTC fund can not be redeemed.That’s why there is the discount.",-0.2411,0.0,0.098,0.0,0.0
2021-03-25,29,"  If they somehow manage to make those BTC withdrawable then yes, the discount is a pretty good thing.

However, I’m not an expert on the U.S. law so not sure if it’s possible besides converting to an ETF.","If they somehow manage to make those BTC withdrawable then yes, the discount is a pretty good thing.However, I’m not an expert on the U.S. law so not sure if it’s possible besides converting to an ETF.",0.7622,0.2,0.051,0.175,0.8722222222222222
2021-03-25,29,"Glassnode shows 29,884 #Bitcoin exiting Bitstamp in 10 minutes.

Can we have an official comment on it? https://t.co/mPpMIPCnZB","Glassnode shows 29,884 #Bitcoin exiting Bitstamp in 10 minutes.Can we have an official comment on it?",0.0,0.0,0.0,0.0,0.0
2021-03-25,29,Another 12k #Bitcoin have left Coinbase. https://t.co/MS5gqkeqE4,Another 12k #Bitcoin have left Coinbase.,0.0,0.0,0.0,0.0,0.0
2021-03-25,29,"Glassnode shows a different figure, though.

4,274 BTC.

Ready for another GN vs CQ fight? https://t.co/9VGmIMSFFb","Glassnode shows a different figure, though.4,274 BTC.Ready for another GN vs CQ fight?",0.4278,0.271,0.13,0.1,0.55
2021-03-27,29,"Despite the rising #Bitcoin price, funding turned negative.

Traders are bearish on average. https://t.co/EUsjGEKsYZ","Despite the rising #Bitcoin price, funding turned negative.Traders are bearish on average.",-0.5719,0.0,0.222,-0.22499999999999998,0.4
2021-03-28,29,"Number of #Bitcoin whales (entities with balance ≥ 1k) has dropped back to the trend line.

However, the price has risen since the start of the dump.

This is bullish and also benefits decentralization.

Text-book consolidation. https://t.co/fYCq6xdPnS","Number of #Bitcoin whales (entities with balance ≥ 1k) has dropped back to the trend line.However, the price has risen since the start of the dump.This is bullish and also benefits decentralization.Text-book consolidation.",0.0772,0.099,0.066,0.0,0.0
2021-03-28,29,"Last two months saw an explosive increase of #Bitcoin supply held by entities with balance 100 - 1k.

Coinbase Custody usually holds customer funds in the wallets that are slightly more than 100 BTC, by the way. https://t.co/bLF1bq8HZz","Last two months saw an explosive increase of #Bitcoin supply held by entities with balance 100 - 1k.Coinbase Custody usually holds customer funds in the wallets that are slightly more than 100 BTC, by the way.",0.3182,0.06,0.0,0.08333333333333333,0.2722222222222222
2021-03-29,30," Same as March, 2020. Although, I expect it to be less pronounced in Bitcoin’s case.","Same as March, 2020. Although, I expect it to be less pronounced in Bitcoin’s case.",0.0,0.0,0.0,-0.08333333333333333,0.09583333333333333
2021-03-29,30,"The retail demand is still here.

Canadian #Bitcoin ETF hasn't had a single day of outflows. That's rare. https://t.co/1zEVrrS0DB",The retail demand is still here.Canadian #Bitcoin ETF hasn't had a single day of outflows. That's rare.,-0.128,0.0,0.081,0.11428571428571428,0.5571428571428572
