date,week,tweets,processed,nltk-compound,nltk-pos,nltk-neg,tb-polarity,tb-subjectivity
2021-02-15,24,"  Max is lying to con people into buying #Bitcoin. I never converted any BTC to fiat, as Schiff Gold never received any BTC in payment for #gold. The BTC was converted to dollars by Bitpay to settle purchases. That's how Bitpay works and it's the only reason any businesses use it.","Max is lying to con people into buying #Bitcoin. I never converted any BTC to fiat, as Schiff Gold never received any BTC in payment for #gold. The BTC was converted to dollars by Bitpay to settle purchases. That's how Bitpay works and it's the only reason any businesses use it.",-0.5267,0.0,0.065,0.0,1.0
2021-02-15,24,   Not if you want to run a profitable business. Margins on #gold are very small. Less than 2%. Plus our costs of goods sold brings operating profits to less than 1% of sales. #Bitcoin's daily price volatility would turn a profitable business into a crap shoot.,Not if you want to run a profitable business. Margins on #gold are very small. Less than 2%. Plus our costs of goods sold brings operating profits to less than 1% of sales. #Bitcoin's daily price volatility would turn a profitable business into a crap shoot.,0.5389,0.168,0.12,-0.2916666666666667,0.2906666666666667
2021-02-15,24, Another lie. I don't think Max ever tells the truth. He took my reply out of context. I wrote that Bitpay converted the #Bitcoin to dollars before paying the dollars to Schiff Gold. Schiff Gold never received any Bitcoin to convert. I did not write that dollars are not fiat.,Another lie. I don't think Max ever tells the truth. He took my reply out of context. I wrote that Bitpay converted the #Bitcoin to dollars before paying the dollars to Schiff Gold. Schiff Gold never received any Bitcoin to convert. I did not write that dollars are not fiat.,0.3182,0.048,0.0,0.0,0.0
2021-02-15,24,"  Schiff Gold partnered with Bitpay in mid 2014, but most of the sales took place during the run up to $20K in 2017. Had Schiff Gold accepted payment in #Bitcoin, then held the Bitcoin and borrowed dollars to pay for the gold it sold customers, it would have gone bankrupt in 2018!","Schiff Gold partnered with Bitpay in mid 2014, but most of the sales took place during the run up to $20K in 2017. Had Schiff Gold accepted payment in #Bitcoin, then held the Bitcoin and borrowed dollars to pay for the gold it sold customers, it would have gone bankrupt in 2018!",-0.63,0.045,0.116,0.3125,0.25
2021-02-15,24,"   You don't understand the gold business. If we sell $10 million of gold, we make about $100K in profit.  But if we accept $10 million in Bitcoin, and hold it for a 50% drop we lose $5 million.  Schiff Gold is a small business. A $5 million dollar loss in one year would lead to BK.","You don't understand the gold business. If we sell $10 million of gold, we make about $100K in profit.  But if we accept $10 million in Bitcoin, and hold it for a 50% drop we lose $5 million.  Schiff Gold is a small business. A $5 million dollar loss in one year would lead to BK.",-0.1531,0.091,0.117,-0.25,0.4
2021-02-16,24,CNBC's  could not resist asking  for his thoughts on #Bitcoin hitting $50K. Too bad he ignored the marxist comment from the former capitalist when he said the Govt. should redistribute more money to African Americans because they need the money the most.,CNBC's  could not resist asking  for his thoughts on #Bitcoin hitting $50K. Too bad he ignored the marxist comment from the former capitalist when he said the Govt. should redistribute more money to African Americans because they need the money the most.,-0.7003,0.0,0.127,0.06000000000000003,0.3333333333333333
2021-02-16,24, We are adding clients every month not losing them.  Why does everything you tweet about me or Bitcoin have to be a lie?  I think it's because you an't really pump Bitcoin by telling the truth.,We are adding clients every month not losing them.  Why does everything you tweet about me or Bitcoin have to be a lie?  I think it's because you an't really pump Bitcoin by telling the truth.,0.5399,0.123,0.0,0.2,0.2
2021-02-16,24,"A financial asset is in a bubble when its price has no relationship to its underlying present value or a reasonable expectation of its future value, and investor conviction in price appreciation is high and fear of loss is low. At $50K #Bitcoin is the biggest bubble of them all.","A financial asset is in a bubble when its price has no relationship to its underlying present value or a reasonable expectation of its future value, and investor conviction in price appreciation is high and fear of loss is low. At $50K #Bitcoin is the biggest bubble of them all.",0.2023,0.178,0.165,0.06,0.2608333333333333
2021-02-16,24,"Now that #Bitcoin has hit $50,000 I must admit that a move up to $100,000 can't be ruled out. However a move down to zero can't be ruled out either. While a temporary move up to $100K is possible, a permanent move down to zero is inevitable. If you don't want to gamble buy #gold.","Now that #Bitcoin has hit $50,000 I must admit that a move up to $100,000 can't be ruled out. However a move down to zero can't be ruled out either. While a temporary move up to $100K is possible, a permanent move down to zero is inevitable. If you don't want to gamble buy #gold.",0.1476,0.035,0.024,-0.07777777777777779,0.6444444444444445
2021-02-16,24, Serious answer - I doubt it will take anywhere near that long. But there may still be a bid in #Bitcoin for years after it collapses to near zero so who knows how many more it will take before that bid disappears completely.,Serious answer - I doubt it will take anywhere near that long. But there may still be a bid in #Bitcoin for years after it collapses to near zero so who knows how many more it will take before that bid disappears completely.,-0.7506,0.0,0.189,0.13095238095238096,0.4666666666666667
2021-02-16,24,"  Yes, but those are actual coins made of real metal. They also likely have value as collectables. I highly doubt that a #Bitcoin collection will have any value in 1,000 years. Plus with 21 million whole Bitcoins they're hardly scarce from a collector's perspective.","Yes, but those are actual coins made of real metal. They also likely have value as collectables. I highly doubt that a #Bitcoin collection will have any value in 1,000 years. Plus with 21 million whole Bitcoins they're hardly scarce from a collector's perspective.",0.5204,0.165,0.076,0.044722222222222226,0.48027777777777775
2021-02-17,24,"Congratulations to my son  for reaching 30,000 Twitter followers. Not bad for an 18-year old. He's definitely worth a follow as long as you ignore his #Bitcoin tweets. He's only a teenager after all and still has a lot to learn.","Congratulations to my son  for reaching 30,000 Twitter followers. Not bad for an 18-year old. He's definitely worth a follow as long as you ignore his #Bitcoin tweets. He's only a teenager after all and still has a lot to learn.",0.8641,0.276,0.052,0.13999999999999999,0.47333333333333333
2021-02-17,24,CNBC finally had a #gold verses #Bitcoin debate. Normally it's just non-stop Bitcoin touting. Perhaps the debate took so long to arrange because the network needed to find someone to argue the gold case who was only mildly bullish on gold but far more enthusiastic about Bitcoin.,CNBC finally had a #gold verses #Bitcoin debate. Normally it's just non-stop Bitcoin touting. Perhaps the debate took so long to arrange because the network needed to find someone to argue the gold case who was only mildly bullish on gold but far more enthusiastic about Bitcoin.,0.5704,0.093,0.06,0.20416666666666666,0.74375
2021-02-18,24," Tesla haven't actually made the $700 million yet.  let's see Tesla sell all those those #Bitcoin first, then we will see how much they actually made.","Tesla haven't actually made the $700 million yet.  let's see Tesla sell all those those #Bitcoin first, then we will see how much they actually made.",0.0,0.0,0.0,0.1125,0.18333333333333332
2021-02-18,24,Bitcoin isn't money. In theory it's a digital fiat currency but in practice it doesn't work. When #Bitcoin is occasionally exchanged for goods or services transactions are more like barter. It's a digital token. The price reflects what collectors or traders are willing to pay.,Bitcoin isn't money. In theory it's a digital fiat currency but in practice it doesn't work. When #Bitcoin is occasionally exchanged for goods or services transactions are more like barter. It's a digital token. The price reflects what collectors or traders are willing to pay.,0.4748,0.08,0.035,0.15,0.275
2021-02-18,24, Schiff Gold accepts dollars though Bitpay.  Bitpay accepts #Bitcoin and promptly sells it to get dollars to pay Schiff Gold.,Schiff Gold accepts dollars though Bitpay.  Bitpay accepts #Bitcoin and promptly sells it to get dollars to pay Schiff Gold.,0.4939,0.2,0.061,0.0,0.0
2021-02-18,24," It's more like a collectable. Investments pay returns. So it's like a baseball card, except not as rare. Personally with 21 million highly divisible Bitcoin, I don't think #Bitcoin collections will have much value in the future.","It's more like a collectable. Investments pay returns. So it's like a baseball card, except not as rare. Personally with 21 million highly divisible Bitcoin, I don't think #Bitcoin collections will have much value in the future.",0.764,0.203,0.036,0.19333333333333336,0.4275
2021-02-19,24, It's a promise that #Bitcoin will never be able to keep.,It's a promise that #Bitcoin will never be able to keep.,0.3182,0.204,0.0,0.5,0.625
2021-02-19,24,"According to  ""Bitcoin is almost as BS as fiat money."" So Musk regards both #Bitcoin and fiat as BS. I agree, I just think Bitcoin, which is digital fiat, is even more BS than the paper fiat issued by central banks. #Gold is not BS. It's real money and better than both!","According to  ""Bitcoin is almost as BS as fiat money."" So Musk regards both #Bitcoin and fiat as BS. I agree, I just think Bitcoin, which is digital fiat, is even more BS than the paper fiat issued by central banks. #Gold is not BS. It's real money and better than both!",0.69,0.106,0.0,0.265,0.31
2021-02-19,24,"  Paper is legal tender, a medium of exchange, a unit of account, and governments require their citizens to pay their taxes in it. #Bitcoin is neither none of those things. It's just a digital token people collect and trade. It's pure PS. The stuff governments issue is partial BS.","Paper is legal tender, a medium of exchange, a unit of account, and governments require their citizens to pay their taxes in it. #Bitcoin is neither none of those things. It's just a digital token people collect and trade. It's pure PS. The stuff governments issue is partial BS.",0.0258,0.032,0.03,0.07857142857142857,0.25
2021-02-19,24, If you HODL your #Bitcoin long enough that's all it will be worth.,If you HODL your #Bitcoin long enough that's all it will be worth.,0.2263,0.137,0.0,0.08333333333333333,0.3333333333333333
2021-02-19,24, No #Bitcoin but I have a lot of money in copper and nickel stocks.,No #Bitcoin but I have a lot of money in copper and nickel stocks.,-0.1531,0.0,0.127,0.0,0.0
2021-02-19,24, The dumb money is buying Bitcoin. They just realize that they're dumb as the price of #Bitcoin is still going up.,The dumb money is buying Bitcoin. They just realize that they're dumb as the price of #Bitcoin is still going up.,-0.765,0.0,0.258,-0.375,0.5
2021-02-19,24, #Bitcoin isn't a commodity.  It isn't an investment asset either.  It's just a collectable and tradable digital token.,#Bitcoin isn't a commodity.  It isn't an investment asset either.  It's just a collectable and tradable digital token.,-0.2755,0.0,0.123,0.0,0.0
2021-02-19,24, #Bitcoin's market cap is irrelevent to #gold.  Plus Bitcoin's market cap will vanish when the bubble bursts.,#Bitcoin's market cap is irrelevent to #gold.  Plus Bitcoin's market cap will vanish when the bubble bursts.,0.0,0.0,0.0,0.0,0.0
2021-02-19,24," Some are buy Bitcoin as an inflation hedge, but most are just speculating on #Bitcoin. Inflation is irrelevant. But when big money finally wakes up to the reality of the  inflation threat, they will buy #gold not Bitcoin.","Some are buy Bitcoin as an inflation hedge, but most are just speculating on #Bitcoin. Inflation is irrelevant. But when big money finally wakes up to the reality of the  inflation threat, they will buy #gold not Bitcoin.",-0.6808,0.0,0.111,0.0,0.65
2021-02-20,24,"  I don't see #Bitcoin as a digital asset, but a digital token. It will have a market price so long as collectors want to hold it or traders what to speculate with it. I do't think it will have much value in the future. But digital claims to real assets might.","I don't see #Bitcoin as a digital asset, but a digital token. It will have a market price so long as collectors want to hold it or traders what to speculate with it. I do't think it will have much value in the future. But digital claims to real assets might.",0.7469,0.166,0.0,0.05,0.14642857142857144
2021-02-20,24," As an engineer you should know the distinction between a tangible element and a mathematical string of numbers is huge. Gold doesn’t need miners to power its existence, the laws of physics do that. #Gold provides owners with optionality: use, improve, or hold. #Bitcoin does not.","As an engineer you should know the distinction between a tangible element and a mathematical string of numbers is huge. Gold doesn’t need miners to power its existence, the laws of physics do that. #Gold provides owners with optionality: use, improve, or hold. #Bitcoin does not.",0.6369,0.11,0.0,0.20000000000000004,0.45
2021-02-20,24,"An email confirming #gold ownership, either from a private vault or government is but a secondary layer of trust. You can confirm this truth on your own while #Bitcoin’s ostensible trust layer requires a network of miners spending 5% of its market value a year to do it for you.","An email confirming #gold ownership, either from a private vault or government is but a secondary layer of trust. You can confirm this truth on your own while #Bitcoin’s ostensible trust layer requires a network of miners spending 5% of its market value a year to do it for you.",0.9472,0.269,0.0,0.09999999999999999,0.5583333333333333
2021-02-20,24,"Money isn't data. Data can represent money but can't replace it. Money improved barter, gold improved money, and data improved #gold. Bitcoin is a return to barter. All sellers will accept money. With #Bitcoin you must find a seller who has what you want and wants what you have.","Money isn't data. Data can represent money but can't replace it. Money improved barter, gold improved money, and data improved #gold. Bitcoin is a return to barter. All sellers will accept money. With #Bitcoin you must find a seller who has what you want and wants what you have.",0.9538,0.292,0.0,0.2,0.1
2021-02-20,24, Not true. #Bitcoin requires far more trust than #gold. I have no trust in Bitcoin.,Not true. #Bitcoin requires far more trust than #gold. I have no trust in Bitcoin.,0.5653,0.331,0.209,0.1416666666666667,0.7166666666666667
2021-02-20,24, What happens when government makes owning #Bitcoin illegal and no ISPs will allow any Bitcoin transactions to pass thought their networks? What will your Bitcoin be worth if you go to jail if you get caught owning it and you can't use the internet to transfer it to anyone?,What happens when government makes owning #Bitcoin illegal and no ISPs will allow any Bitcoin transactions to pass thought their networks? What will your Bitcoin be worth if you go to jail if you get caught owning it and you can't use the internet to transfer it to anyone?,-0.5204,0.069,0.112,-0.10000000000000002,0.19999999999999998
2021-02-20,24,  That's even more BS than #Bitcoin.,That's even more BS than #Bitcoin.,0.0,0.0,0.0,0.5,0.5
2021-02-20,24," As an engineer you should know the distinction between a tangible element and a mathematical string of numbers is huge. Gold doesn’t need miners to power its existence, the laws of physics do that. #Gold provides owners with optionality: use, improve, or hold. #Bitcoin does not.","As an engineer you should know the distinction between a tangible element and a mathematical string of numbers is huge. Gold doesn’t need miners to power its existence, the laws of physics do that. #Gold provides owners with optionality: use, improve, or hold. #Bitcoin does not.",0.6369,0.11,0.0,0.20000000000000004,0.45
2021-02-20,24," An email confirming #gold ownership, either from a private vault or government is but a secondary layer of trust. You can confirm this truth on your own while #Bitcoin’s ostensible trust layer requires a network of miners spending 5% of its market value a year to do it for you.","An email confirming #gold ownership, either from a private vault or government is but a secondary layer of trust. You can confirm this truth on your own while #Bitcoin’s ostensible trust layer requires a network of miners spending 5% of its market value a year to do it for you.",0.9472,0.269,0.0,0.09999999999999999,0.5583333333333333
2021-02-20,24," Money isn't data. Data can represent money but can't replace it. Money improved barter, gold improved money, and data improved #gold. Bitcoin is a return to barter. All sellers will accept money. With #Bitcoin you must find a seller who has what you want and wants what you have.","Money isn't data. Data can represent money but can't replace it. Money improved barter, gold improved money, and data improved #gold. Bitcoin is a return to barter. All sellers will accept money. With #Bitcoin you must find a seller who has what you want and wants what you have.",0.9538,0.292,0.0,0.2,0.1
2021-02-20,24,  You only need miners to bring new #gold out of the ground. You don't need miners to support the gold after it's mined. #Bitcoin requires miners to keep working for it to remain viable.,You only need miners to bring new #gold out of the ground. You don't need miners to support the gold after it's mined. #Bitcoin requires miners to keep working for it to remain viable.,0.4019,0.076,0.0,0.06818181818181818,0.7272727272727273
2021-02-20,24,"  Roosevelt made owning gold illegal. None was ever confiscated. Some people turned theirs in, others did not. Much easier to ban #Bitcoin than #gold. Digital footprints are easy to track.","Roosevelt made owning gold illegal. None was ever confiscated. Some people turned theirs in, others did not. Much easier to ban #Bitcoin than #gold. Digital footprints are easy to track.",-0.7672,0.075,0.248,-0.04166666666666666,0.3833333333333333
2021-02-20,24," Outperforming #gold and taking its place are two entirely different things.  A lot of assets have also outperformed gold, but that does not mean they are taking gold's place. #Bitcoin is not a store of value. It's a speculative digital token. No value but a soaring market price.","Outperforming #gold and taking its place are two entirely different things.  A lot of assets have also outperformed gold, but that does not mean they are taking gold's place. #Bitcoin is not a store of value. It's a speculative digital token. No value but a soaring market price.",-0.7147,0.059,0.159,0.052083333333333336,0.4291666666666667
2021-02-20,24," Seems high compared to what? That's the problem. Bitcoin has no real value, no use case or utility, and there's no historical comparison that relates the price of #Bitcoin to the price of any other good. You also can't value it like an investment as it has no earnings or yield.","Seems high compared to what? That's the problem. Bitcoin has no real value, no use case or utility, and there's no historical comparison that relates the price of #Bitcoin to the price of any other good. You also can't value it like an investment as it has no earnings or yield.",-0.6007,0.122,0.215,0.127,0.363
2021-02-20,24,  Since #Bitcoin has no value I think it's price is high compared to everything else that does! In the market its price is what anyone is willing to pay who does not understand or care that it has no value.,Since #Bitcoin has no value I think it's price is high compared to everything else that does! In the market its price is what anyone is willing to pay who does not understand or care that it has no value.,-0.4442,0.103,0.187,0.225,0.645
2021-02-21,24,"  The same way you ""spend"" your #Bitcoin. It's actually easier and less expensive.","The same way you ""spend"" your #Bitcoin. It's actually easier and less expensive.",0.4215,0.189,0.0,-0.16666666666666666,0.24791666666666667
2021-02-21,24," This video does a much better job of explaining #Bitcoin.
https://t.co/n3AjB0sSHR",This video does a much better job of explaining #Bitcoin.,0.4404,0.244,0.0,0.5,0.5
2021-02-21,24," Ultimately the ones crying will be those who paid $58,000 for #Bitcoin or failed to take advantage of the opportunity to sell.","Ultimately the ones crying will be those who paid $58,000 for #Bitcoin or failed to take advantage of the opportunity to sell.",-0.3818,0.164,0.219,-0.2333333333333333,0.6333333333333334
2021-02-21,24,"If I were to actually buy some #Bitcoin, how would I know when to sell? If your answer is to never sell, then what is the point of buying in the first place?","If I were to actually buy some #Bitcoin, how would I know when to sell? If your answer is to never sell, then what is the point of buying in the first place?",0.0,0.0,0.0,0.125,0.21666666666666667
2021-02-21,24," I'm not talking about needing to sell. It's evaluating when to sell. With a stock there's a way to measure valuation. Not with #Bitcoin. Also, since Bitcoin is so volatile I can't just sell if the price drops 20% to cut my losses, as it can do that on any given day.","I'm not talking about needing to sell. It's evaluating when to sell. With a stock there's a way to measure valuation. Not with #Bitcoin. Also, since Bitcoin is so volatile I can't just sell if the price drops 20% to cut my losses, as it can do that on any given day.",-0.5859,0.0,0.093,0.0,0.0
2021-02-21,24," #Gold is a more stable, long-term store of value, and it has historic price relationships to other commodities to have an idea if it gets historically expensive. #Bitcoin is just a highly speculative digital token, with no real value, or historic price relationship to anything.","#Gold is a more stable, long-term store of value, and it has historic price relationships to other commodities to have an idea if it gets historically expensive. #Bitcoin is just a highly speculative digital token, with no real value, or historic price relationship to anything.",0.699,0.183,0.045,-0.008125,0.301875
2021-02-21,24," I have #gold in case the monetary system implodes.There is no guarantee such an explosion would be good for #Bitcoin. In fact, Bitcoin may explode first, or at the same time. Bitcoin would be a speculation on the bubble getting bigger before I bailed.","I have #gold in case the monetary system implodes.There is no guarantee such an explosion would be good for #Bitcoin. In fact, Bitcoin may explode first, or at the same time. Bitcoin would be a speculation on the bubble getting bigger before I bailed.",0.4019,0.109,0.049,0.19,0.41166666666666674
2021-02-21,24," Perhaps, but what if it never makes it that high? Nothing is a guarantee. I've seen a lot of people on Twitter speculate that when I finally capitulate and buy #Bitcoin that may mark the top.","Perhaps, but what if it never makes it that high? Nothing is a guarantee. I've seen a lot of people on Twitter speculate that when I finally capitulate and buy #Bitcoin that may mark the top.",0.0232,0.062,0.06,0.22,0.68
2021-02-21,24,  But #Bitcoin is neither a global currency nor a store of value. It's a digital token that an enthusiastic minority of people around the globe are speculating with.,But #Bitcoin is neither a global currency nor a store of value. It's a digital token that an enthusiastic minority of people around the globe are speculating with.,0.2878,0.113,0.072,0.19999999999999998,0.3
2021-02-21,24," Bitcoin can fall just as fast. If investors really were concerned about hyper-inflation the price of everything would be surging, including bond yields, not just #Bitcoin. This may happen one day, but if it does people may dump Bitcoin just as fast to get into something real.","Bitcoin can fall just as fast. If investors really were concerned about hyper-inflation the price of everything would be surging, including bond yields, not just #Bitcoin. This may happen one day, but if it does people may dump Bitcoin just as fast to get into something real.",-0.5267,0.0,0.069,0.2,0.425
2021-02-21,24," Since the #Bitcoin buy was announced Tesla stock has dropped by 9% in a relatively flat market. So far the purchase is not working out for #Tesla  shareholders. It's not a profit until  sells. So the jury is still out. Musk may be a legend, but then again so was Custer.","Since the #Bitcoin buy was announced Tesla stock has dropped by 9% in a relatively flat market. So far the purchase is not working out for #Tesla  shareholders. It's not a profit until  sells. So the jury is still out. Musk may be a legend, but then again so was Custer.",-0.1786,0.0,0.035,0.037500000000000006,0.5625
2021-02-21,24, Good point.  I think they're both bubbles.  I just think the #Bitcoin bubble is bigger and more likely to pop.  Plus I think stocks are overpriced. I think Bitcoin is over valued at any price.,Good point.  I think they're both bubbles.  I just think the #Bitcoin bubble is bigger and more likely to pop.  Plus I think stocks are overpriced. I think Bitcoin is over valued at any price.,0.7003,0.167,0.0,0.3,0.65
2021-02-22,25, I can live in a house.  It provides shelter.  I can't do anything with #Bitcoin and neither can anyone else.,I can live in a house.  It provides shelter.  I can't do anything with #Bitcoin and neither can anyone else.,0.0,0.0,0.0,0.13636363636363635,0.5
