date,week,tweets,processed,nltk-compound,nltk-pos,nltk-neg,tb-polarity,tb-subjectivity
2021-01-11,19,Bitcoin proponents claim that #Bitcoin represents the greatest transfer of wealth in history. I partially agree. Not sure it's the greatest but a large wealth transfer is taking place. But the wealth is being transferred from the people who buy Bitcoin to the people who sell it.,Bitcoin proponents claim that #Bitcoin represents the greatest transfer of wealth in history. I partially agree. Not sure it's the greatest but a large wealth transfer is taking place. But the wealth is being transferred from the people who buy Bitcoin to the people who sell it.,0.9448,0.309,0.026,0.37285714285714283,0.7234920634920635
2021-01-11,19, Also whales who bought #Bitcoin at much lower prices are selling it now to HODLers at much higher prices.,Also whales who bought #Bitcoin at much lower prices are selling it now to HODLers at much higher prices.,-0.296,0.0,0.109,0.225,0.35
2021-01-11,19, But when people buy shares of a company they actually get something of value for their money. When they buy #Bitcoin they get nothing.,But when people buy shares of a company they actually get something of value for their money. When they buy #Bitcoin they get nothing.,0.5574,0.18,0.0,0.0,0.1
2021-01-11,19, #Bitcoin is the best thing to happen to the people who got in early and who have been selling into the mania at much higher prices.,#Bitcoin is the best thing to happen to the people who got in early and who have been selling into the mania at much higher prices.,0.6369,0.144,0.0,0.45,0.3666666666666667
2021-01-11,19,Just watched . During 3 hours of market coverage Bitcoin's 20% weekend drop was barely mentioned. Had #Bitcoin risen another 20% over the weekend it would've been the main topic of discussion. At least the Bitcoin bug wasn't removed again. That requires a bigger drop.,Just watched . During 3 hours of market coverage Bitcoin's 20% weekend drop was barely mentioned. Had #Bitcoin risen another 20% over the weekend it would've been the main topic of discussion. At least the Bitcoin bug wasn't removed again. That requires a bigger drop.,-0.4939,0.0,0.095,-0.02083333333333333,0.33333333333333337
2021-01-11,19," I see your point. So when #Bitcoin breaks back below $20K it will be no big deal either, as it will just be a return to last month's prices.","I see your point. So when #Bitcoin breaks back below $20K it will be no big deal either, as it will just be a return to last month's prices.",-0.296,0.0,0.078,0.0,0.05555555555555556
2021-01-11,19," #Bitcoin doesn't compete with #gold as the two have nothing in common. Bitcoin is a highly speculative ""asset."" It makes more sense to compare it to a lottery ticket than to gold. The gold comparison is just part of the Bitcoin marketing con to keep the pyramid scheme going.","#Bitcoin doesn't compete with #gold as the two have nothing in common. Bitcoin is a highly speculative ""asset."" It makes more sense to compare it to a lottery ticket than to gold. The gold comparison is just part of the Bitcoin marketing con to keep the pyramid scheme going.",0.1761,0.035,0.0,0.12,0.5133333333333333
2021-01-11,19,"Bitcoin traded near $42K on Friday and near $30K on Monday. An asset that drops 28% over a weekend is not a safe-haven, a store of value, or a viable hedge against #inflation. If you want to gamble on #Bitcoin, buy Bitcoin. But if you want to hedge against inflation buy #gold.","Bitcoin traded near $42K on Friday and near $30K on Monday. An asset that drops 28% over a weekend is not a safe-haven, a store of value, or a viable hedge against #inflation. If you want to gamble on #Bitcoin, buy Bitcoin. But if you want to hedge against inflation buy #gold.",0.6705,0.146,0.0,0.1,0.4
2021-01-11,19,I will be on Fox Business today at 2:30 EST with  to debate #Bitcoin verses #Gold. It's really not a debate as the two have nothing in common. The problem is people buying Bitcoin think they're buying digital gold. They're just buying the latest iteration of fool's gold.,I will be on Fox Business today at 2:30 EST with  to debate #Bitcoin verses #Gold. It's really not a debate as the two have nothing in common. The problem is people buying Bitcoin think they're buying digital gold. They're just buying the latest iteration of fool's gold.,-0.4019,0.0,0.057,0.024999999999999994,0.4
2021-01-11,19," Why do you think people speculating on Bitcoin threatens me? No one can force me to buy Bitcoin, so it's not a threat to me.  It's only a threat to the people who buy it!","Why do you think people speculating on Bitcoin threatens me? No one can force me to buy Bitcoin, so it's not a threat to me.  It's only a threat to the people who buy it!",0.376,0.159,0.119,0.0,1.0
2021-01-11,19,Very few institutional investors are buying #Bitcoin. It just that those few that are buying are extremely vocal about their positions. They need to convince others to buy to push up the price so they can sell.   The financial media also gives them a platform to talk their books.,Very few institutional investors are buying #Bitcoin. It just that those few that are buying are extremely vocal about their positions. They need to convince others to buy to push up the price so they can sell.   The financial media also gives them a platform to talk their books.,0.25,0.041,0.0,-0.14625,0.3075
2021-01-12,19,  Define huge. How many institutional investors have actually purchased Bitcoin? I'm sure it's a small percentage of the total. But I don't doubt that some have. Institutional investors have made foolish investments in the past. I see no reason why #Bitcoin would be an exception.,Define huge. How many institutional investors have actually purchased Bitcoin? I'm sure it's a small percentage of the total. But I don't doubt that some have. Institutional investors have made foolish investments in the past. I see no reason why #Bitcoin would be an exception.,0.3421,0.14,0.09,0.1285714285714286,0.5412698412698412
2021-01-12,19,It's amazing that 's main on-screen quote bug toggles between the Dow Jones and #Bitcoin. According to CNBC these are the two most important prices relevant to their viewers. This is one reason why CNBC should be completely irrelevent to investors.,It's amazing that 's main on-screen quote bug toggles between the Dow Jones and #Bitcoin. According to CNBC these are the two most important prices relevant to their viewers. This is one reason why CNBC should be completely irrelevent to investors.,0.7089,0.131,0.0,0.3611111111111111,0.6722222222222222
2021-01-12,19,"   was more relevant when they were more of a news outlet, and less cheerleaders for the U.S. stock market and U.S. economy.  When they were more balanced they often invited me on to make my case. They no longer allow that case to be made, unless it's to shill #Bitcoin.","was more relevant when they were more of a news outlet, and less cheerleaders for the U.S. stock market and U.S. economy.  When they were more balanced they often invited me on to make my case. They no longer allow that case to be made, unless it's to shill #Bitcoin.",0.1548,0.073,0.042,0.3466666666666666,0.49333333333333335
2021-01-12,19," Yes, but irrelevent as Hayek never would have considered #Bitcoin to be ""good money.""","Yes, but irrelevent as Hayek never would have considered #Bitcoin to be ""good money.""",0.6908,0.322,0.0,0.7,0.6000000000000001
2021-01-12,19,"  Mark, you can't store what you don't have. #Gold is a store of value as you are storing gold for future use as a metal. Jewelers will need gold, computer chip manufactures will need gold, dentists, etc. But no one actually needs #Bitcoin now, so no one will need it in the future.","Mark, you can't store what you don't have. #Gold is a store of value as you are storing gold for future use as a metal. Jewelers will need gold, computer chip manufactures will need gold, dentists, etc. But no one actually needs #Bitcoin now, so no one will need it in the future.",-0.25,0.044,0.08,0.0,0.11666666666666665
2021-01-12,19,"Stocks have earning which are used to pay dividends or buy back shares. Real estate pays rent and bonds pay interest. Commodities can be consumed or used, or in the case of #gold stored indefinitely for further use. #Bitcoin earns nothing, pays nothing, and is used for nothing.","Stocks have earning which are used to pay dividends or buy back shares. Real estate pays rent and bonds pay interest. Commodities can be consumed or used, or in the case of #gold stored indefinitely for further use. #Bitcoin earns nothing, pays nothing, and is used for nothing.",0.5267,0.1,0.054,0.06666666666666667,0.26666666666666666
2021-01-12,19," I am not saying the price of Bitcoin didn't go up. I'm just staying that unlike actual investments, or commodities, there is no real value to sustain the rise. So it's just a bubble, and the price will completely collapse as soon as speculative demand dries up.","I am not saying the price of Bitcoin didn't go up. I'm just staying that unlike actual investments, or commodities, there is no real value to sustain the rise. So it's just a bubble, and the price will completely collapse as soon as speculative demand dries up.",-0.5256,0.075,0.141,0.0,0.26666666666666666
2021-01-12,19,"  Yes, they do that to prop up the price so they can sucker in more buyers so they can sell more #Bitcoin at higher prices.  It's called market manipulation.","Yes, they do that to prop up the price so they can sucker in more buyers so they can sell more #Bitcoin at higher prices.  It's called market manipulation.",-0.4877,0.078,0.17,0.2375,0.575
2021-01-12,19,"As long as people don't realize or don't care that #Bitcoin has no actual value, and continue to buy it anyway, its price can continue to rise. But eventually those who don't care will start caring, and those who don't understand will figure it out. By then it's too late to sell.","As long as people don't realize or don't care that #Bitcoin has no actual value, and continue to buy it anyway, its price can continue to rise. But eventually those who don't care will start caring, and those who don't understand will figure it out. By then it's too late to sell.",-0.2158,0.093,0.124,-0.11666666666666665,0.3666666666666667
2021-01-12,19," It's hard to tell, but my guess is that I would have even more followers if I got onboard the #Bitcoin train rather than trying to convince others to jump off.","It's hard to tell, but my guess is that I would have even more followers if I got onboard the #Bitcoin train rather than trying to convince others to jump off.",0.3182,0.081,0.039,0.10416666666666666,0.5208333333333333
2021-01-12,19, My last four posts didn't mention Bitcoin.,My last four posts didn't mention Bitcoin.,0.0,0.0,0.0,0.0,0.06666666666666667
2021-01-12,19, The problem is that no one needs #Bitcoin for anything.,The problem is that no one needs #Bitcoin for anything.,-0.5994,0.0,0.38,0.0,0.0
2021-01-12,19, #Bitcoin does not compete with #gold. It has nothing in common with gold. I don't hate bitcoin. Hate is an emotion. I just know it's doomed to fail. You love it because you own it. Your emotions have gotten the better of you.,#Bitcoin does not compete with #gold. It has nothing in common with gold. I don't hate bitcoin. Hate is an emotion. I just know it's doomed to fail. You love it because you own it. Your emotions have gotten the better of you.,0.6593,0.235,0.138,-0.11428571428571432,0.6714285714285714
2021-01-12,19," That's what you don't understand. #Gold and wheat are both commodities, with historic price relationships. There is real demand for both. Bakers need wheat, and all sorts of industries need gold. #Bitcoin is used for nothing, and has no historic price relationship to anything.","That's what you don't understand. #Gold and wheat are both commodities, with historic price relationships. There is real demand for both. Bakers need wheat, and all sorts of industries need gold. #Bitcoin is used for nothing, and has no historic price relationship to anything.",0.0997,0.042,0.033,0.06666666666666667,0.10000000000000002
2021-01-12,19,  Except with #gold you mine something and with #Bitcoin you mine nothing.  That's the critical difference you overlook.,Except with #gold you mine something and with #Bitcoin you mine nothing.  That's the critical difference you overlook.,0.2411,0.103,0.0,0.0,0.8
2021-01-12,19,  #Gold was valued as a metal before it was used as money. #Bitcoin was never valued as anything prior to its being marketed as the money of the future.,#Gold was valued as a metal before it was used as money. #Bitcoin was never valued as anything prior to its being marketed as the money of the future.,0.7003,0.182,0.0,0.0,0.0625
2021-01-12,19,"  Too bad you're not. #Bitcoin has never been money in the past, it's not money now, and it will never be money in the future. In theory it could be a private digital fiat currency, but in practice it can't even achieve that.","Too bad you're not. #Bitcoin has never been money in the past, it's not money now, and it will never be money in the future. In theory it could be a private digital fiat currency, but in practice it can't even achieve that.",-0.3071,0.0,0.052,-0.18999999999999997,0.2833333333333333
2021-01-12,19,"  The problem is that you still don't understand what money is. Eventually you will learn, but not likely until after you've lost most of yours on #Bitcoin.","The problem is that you still don't understand what money is. Eventually you will learn, but not likely until after you've lost most of yours on #Bitcoin.",-0.5859,0.0,0.161,0.25,0.75
2021-01-12,19,"  I have no interest in betting on #Bitcoin prices, especially with strangers on Twitter. It makes no difference to me what price Bitcoin trades at in the future as I will not be buying any. But I'm already betting over $100 million of my net worth against Bitcoin by not owing any.","I have no interest in betting on #Bitcoin prices, especially with strangers on Twitter. It makes no difference to me what price Bitcoin trades at in the future as I will not be buying any. But I'm already betting over $100 million of my net worth against Bitcoin by not owing any.",0.128,0.089,0.08,0.075,0.30625
2021-01-13,19,"    No it doesn't. #Bitcoin's market cap is an illusion. Only a few people can actually sell. When a significant number tries to sell to convert their paper gains into real stuff, such as consumer goods or other assets, Bitcoin's price will crash and its paper market cap will vanish.","No it doesn't. #Bitcoin's market cap is an illusion. Only a few people can actually sell. When a significant number tries to sell to convert their paper gains into real stuff, such as consumer goods or other assets, Bitcoin's price will crash and its paper market cap will vanish.",0.0772,0.136,0.092,0.018750000000000003,0.45625000000000004
2021-01-13,19,     Because stocks have earnings and can pay dividends. People will always need/want income and will invest to get it. #Gold is a metal and those who need to use it will always pay to buy it. Since no one needs #Bitcoin there may not be any buyers when current owners want to sell.,Because stocks have earnings and can pay dividends. People will always need/want income and will invest to get it. #Gold is a metal and those who need to use it will always pay to buy it. Since no one needs #Bitcoin there may not be any buyers when current owners want to sell.,-0.4019,0.024,0.092,0.0,0.4
2021-01-13,19,   I talk about #Bitcoin a lot because it makes a lot of difference to those foolish enough to own it.,I talk about #Bitcoin a lot because it makes a lot of difference to those foolish enough to own it.,-0.2732,0.0,0.116,0.3,0.75
2021-01-13,19,"I can't really claim to know how he feels as I only lost about 1/3 of a #Bitcoin. But at least he had a password to lose. I never knew mine, or that I even had one. I only knew my pin, and when my wallet no longer accepted it I lost access to its contents.https://t.co/uaQt0pTtKs","I can't really claim to know how he feels as I only lost about 1/3 of a #Bitcoin. But at least he had a password to lose. I never knew mine, or that I even had one. I only knew my pin, and when my wallet no longer accepted it I lost access to its contents.",-0.7506,0.038,0.174,-0.024999999999999994,0.65
2021-01-14,19," Supply and demand set price, not value. You can build on land, farm it, mine, it, or rent it. A Picasso delivers status to its owner as well the pride and appreciation that comes with ownership. Owing the Mavericks is fun, prestigious, and generates income. #Bitcoin has no value.","Supply and demand set price, not value. You can build on land, farm it, mine, it, or rent it. A Picasso delivers status to its owner as well the pride and appreciation that comes with ownership. Owing the Mavericks is fun, prestigious, and generates income. #Bitcoin has no value.",0.6517,0.189,0.132,0.3,0.2
2021-01-14,19,  You can't hang a #Bitcoin on you wall to admire or impress your friends.  There is no special pride or satisfaction that comes with owing Bitcoin. Anyone in the world can buy a Satoshi. There is nothing special about it at all.,You can't hang a #Bitcoin on you wall to admire or impress your friends.  There is no special pride or satisfaction that comes with owing Bitcoin. Anyone in the world can buy a Satoshi. There is nothing special about it at all.,0.9485,0.367,0.041,0.08928571428571429,0.5714285714285714
2021-01-14,19,"   #Bitcoin does not store value.  It has a market price that fluctuates based on speculative demand to hold or buy it. The price can rise or fall, but in the long run it could easily approach zero.  No value is stored.  You can't store what you don't possess.","#Bitcoin does not store value.  It has a market price that fluctuates based on speculative demand to hold or buy it. The price can rise or fall, but in the long run it could easily approach zero.  No value is stored.  You can't store what you don't possess.",-0.4257,0.08,0.152,0.19166666666666668,0.6166666666666667
2021-01-14,19,"   Bitcoin does not store energy. I can not use my Bitcoin to power anything.  But a lot of energy is wasted creating worthless Bitcoin, and maintaining the network.","Bitcoin does not store energy. I can not use my Bitcoin to power anything.  But a lot of energy is wasted creating worthless Bitcoin, and maintaining the network.",-0.7599,0.067,0.295,-0.5,0.45
2021-01-14,19,"    Yes that can be lost too, as well as the belief that anyone will actually want to own #Bitcoin in the future.","Yes that can be lost too, as well as the belief that anyone will actually want to own #Bitcoin in the future.",0.4215,0.231,0.087,0.19999999999999998,0.4083333333333334
2021-01-14,19,     That can be verified. The reason fake #gold doesn't have the same value as real gold is that it doesn't have the same valuable metallic properties as real gold. So it doesn't deliver the same functionally to the end user. There's no real difference between real and fake #Bitcoin.,That can be verified. The reason fake #gold doesn't have the same value as real gold is that it doesn't have the same valuable metallic properties as real gold. So it doesn't deliver the same functionally to the end user. There's no real difference between real and fake #Bitcoin.,-0.4404,0.095,0.145,-0.05555555555555555,0.39722222222222225
2021-01-14,19,"    People value the network only because they value #Bitcoin. When they no longer value Bitcoin, the network will either adapt to perform other functions, or it will no longer be valued either and will fall apart.","People value the network only because they value #Bitcoin. When they no longer value Bitcoin, the network will either adapt to perform other functions, or it will no longer be valued either and will fall apart.",0.6908,0.227,0.099,-0.0625,0.6875
2021-01-14,19,"The reckless monetary policy of the #Fed and the economic destruction it will leave in its wake does help the Bitcoin sales pitch. But it does nothing to help Bitcoin itself. Unfortunately, most who buy #Bitcoin to protect themselves will be worse off than those who do nothing.","The reckless monetary policy of the #Fed and the economic destruction it will leave in its wake does help the Bitcoin sales pitch. But it does nothing to help Bitcoin itself. Unfortunately, most who buy #Bitcoin to protect themselves will be worse off than those who do nothing.",-0.6249,0.131,0.214,0.09999999999999998,0.4333333333333333
2021-01-14,19, You can't buy a coke with #Bitcoin either.,You can't buy a coke with #Bitcoin either.,0.0,0.0,0.0,0.0,0.0
2021-01-14,19, The dangerous combination with #Bitcoin is ignorance and greed.,The dangerous combination with #Bitcoin is ignorance and greed.,-0.8074,0.0,0.58,-0.6,0.9
2021-01-14,19," You can't power anything with #Bitcoin. But a lot of power is wasted creating Bitcoin and operating the network.  Once Bitcoin crashes for good, and all of this finally nonsense finally comes to an end, all of that power will be freed up for productive uses.","You can't power anything with #Bitcoin. But a lot of power is wasted creating Bitcoin and operating the network.  Once Bitcoin crashes for good, and all of this finally nonsense finally comes to an end, all of that power will be freed up for productive uses.",0.2263,0.145,0.11,0.12499999999999999,0.65
2021-01-15,19,The recent surge in #Bitcoin is not being driven by wide-spread institutional adoption.  and other crypto shills are exploiting the fact that a few high-profile institutions have taken positions to create the false impression of larger participation to sucker in more buyers.,The recent surge in #Bitcoin is not being driven by wide-spread institutional adoption.  and other crypto shills are exploiting the fact that a few high-profile institutions have taken positions to create the false impression of larger participation to sucker in more buyers.,-0.5106,0.085,0.133,-0.07500000000000002,0.44642857142857145
2021-01-15,19," Bitcoin can't be money as money is the most marketable commodity. #Bitcoin is not a commodity, so it can't be money.  The best Bitcoin can ever hope to be is a digital fiat currency, but it hasn't even managed to achieve that yet. #Gold is the best money.","Bitcoin can't be money as money is the most marketable commodity. #Bitcoin is not a commodity, so it can't be money.  The best Bitcoin can ever hope to be is a digital fiat currency, but it hasn't even managed to achieve that yet. #Gold is the best money.",0.8847,0.194,0.0,0.625,0.275
2021-01-18,20," Comparing #Bitcoin to #gold or any other store of value is part of the Bitcoin marketing fraud.  Bitcoin is a highly speculative digital token with no actual value that can be stored. Its price may rise, but not its value. Its lack of real value will be its inevitably downfall!","Comparing #Bitcoin to #gold or any other store of value is part of the Bitcoin marketing fraud.  Bitcoin is a highly speculative digital token with no actual value that can be stored. Its price may rise, but not its value. Its lack of real value will be its inevitably downfall!",0.5087,0.19,0.117,0.03916666666666667,0.3858333333333333
2021-01-18,20,  Fake news is what Bitcoin is all about so your spending it in other areas is not unexpected.,Fake news is what Bitcoin is all about so your spending it in other areas is not unexpected.,-0.4767,0.0,0.154,-0.225,0.7916666666666666
2021-01-21,20,"  #Gold doesn't have to go up every day to be an inflation hedge. #Bitcoin can't hedge anything, as it's riskier than any other asset, and not really correlated to any. It also has no intrinsic value or historic price relationship relative to other commodities that can be stored.","#Gold doesn't have to go up every day to be an inflation hedge. #Bitcoin can't hedge anything, as it's riskier than any other asset, and not really correlated to any. It also has no intrinsic value or historic price relationship relative to other commodities that can be stored.",0.0772,0.092,0.086,-0.06999999999999999,0.19
2021-01-22,20,Sequoia Holdings isn't paying its employees in #Bitcoin. It's just a bunch of hype to falsely portray Bitcoin as money to sucker in buyers. Sequoia is offering to buy Bitcoin for its employees using part of their dollar salaries instead of the employees buying Bitcoin themselves.,Sequoia Holdings isn't paying its employees in #Bitcoin. It's just a bunch of hype to falsely portray Bitcoin as money to sucker in buyers. Sequoia is offering to buy Bitcoin for its employees using part of their dollar salaries instead of the employees buying Bitcoin themselves.,-0.5267,0.0,0.072,-0.35000000000000003,0.7
2021-01-22,20," Being paid in Bitcoin is a salary set in #Bitcoin, like 1/10 of a Bitcoin per week. Then each week the company pays the worker 1/10 of a Bitcoin regardless of its market value in dollars. When companies buy stock with part of an employees paycheck workers are not paid in stock.","Being paid in Bitcoin is a salary set in #Bitcoin, like 1/10 of a Bitcoin per week. Then each week the company pays the worker 1/10 of a Bitcoin regardless of its market value in dollars. When companies buy stock with part of an employees paycheck workers are not paid in stock.",0.5994,0.094,0.0,0.0,0.0
2021-01-22,20, Bitcoin's supposed advantage was that it allowed individuals to transfer #Bitcoin without the loss of privacy and added costs associated with conventional money transfers that were subject to AML and KYC. Once it's subject to those same regulations it offers no value proposition.,Bitcoin's supposed advantage was that it allowed individuals to transfer #Bitcoin without the loss of privacy and added costs associated with conventional money transfers that were subject to AML and KYC. Once it's subject to those same regulations it offers no value proposition.,0.8517,0.222,0.043,-0.07523809523809524,0.22976190476190475
