date,week,tweets,processed,nltk-compound,nltk-pos,nltk-neg,tb-polarity,tb-subjectivity
2020-09-03,1,"This is misleading. While gold declined, it fell much less than the market. Gold rose in value relative to stocks. #Bitcoin on the other hand fell much more than the market. For #gold owners stocks got cheaper. For Bitcoin owners they got more expensive.
https://t.co/XTybjujvT6","This is misleading. While gold declined, it fell much less than the market. Gold rose in value relative to stocks. #Bitcoin on the other hand fell much more than the market. For #gold owners stocks got cheaper. For Bitcoin owners they got more expensive.",0.4404,0.111,0.054,0.11547619047619048,0.4416666666666667
2020-09-03,1," The article compared gold and bitcoin to stocks. The two assets reacted very differently to today's selloff.  The article had that part wrong, which is why I called it out.","The article compared gold and bitcoin to stocks. The two assets reacted very differently to today's selloff.  The article had that part wrong, which is why I called it out.",-0.34,0.053,0.097,-0.25,0.8400000000000001
2020-09-04,1,  Selling #Bitcoin quickly was the smartest move his made yet.,Selling #Bitcoin quickly was the smartest move his made yet.,0.6124,0.308,0.0,0.3333333333333333,0.5
2020-09-06,1, #Bitcoin can just as easily be consolidating before the next breakdown. Consolidations after sharp moves typically continue the move that proceeds them. The more the 10K support level is tested the weaker it gets. Markets rarely give investors that many chances to buy the bottom.,#Bitcoin can just as easily be consolidating before the next breakdown. Consolidations after sharp moves typically continue the move that proceeds them. The more the 10K support level is tested the weaker it gets. Markets rarely give investors that many chances to buy the bottom.,0.5046,0.14,0.057,0.20595238095238094,0.569047619047619
2020-09-06,1,"  No, in this case the larger proceeding move was up, not down. Plus #gold is consolidating above its old highs. #Bitcoin is still well below its prior highs. If Bitcoin surges above $20K and then consolidates above $20k, it will be in a similar position to the one gold is in now.","No, in this case the larger proceeding move was up, not down. Plus #gold is consolidating above its old highs. #Bitcoin is still well below its prior highs. If Bitcoin surges above $20K and then consolidates above $20k, it will be in a similar position to the one gold is in now.",-0.0258,0.039,0.041,0.022222222222222227,0.21111111111111114
2020-09-06,1,"  I was right on #gold, but wrong on #Bitcoin. The latter did managed to get through resistance and rally up to $12K, thanks in large part to a ride on gold's coattails and a massive TV advertising buy by Grayscale. By falling back to $10K Bitcoin quickly returned to a bear market.","I was right on #gold, but wrong on #Bitcoin. The latter did managed to get through resistance and rally up to $12K, thanks in large part to a ride on gold's coattails and a massive TV advertising buy by Grayscale. By falling back to $10K Bitcoin quickly returned to a bear market.",-0.296,0.07,0.11,0.06666666666666667,0.44553571428571426
2020-09-06,1,  While your analysis of the problem is generally correct and well written your conclusion that #Bitcoin is a solution for investors is wrong. While mining #gold from oceans and space is inevitable as other supplies are exhausted the effects on future supply growth will be minimal.,While your analysis of the problem is generally correct and well written your conclusion that #Bitcoin is a solution for investors is wrong. While mining #gold from oceans and space is inevitable as other supplies are exhausted the effects on future supply growth will be minimal.,-0.3182,0.129,0.153,-0.15357142857142855,0.5999999999999999
2020-09-07,2,Against my advice my son  just bought even more #Bitcoin. Whose advice do you want to follow? A 57-year-old experienced investor/business owner who's been an investment professional for over 30 years or an 18-year-old college freshman who's never even had a job.,Against my advice my son  just bought even more #Bitcoin. Whose advice do you want to follow? A 57-year-old experienced investor/business owner who's been an investment professional for over 30 years or an 18-year-old college freshman who's never even had a job.,0.0772,0.032,0.0,0.46666666666666673,0.5
2020-09-07,2,  The peso or #Bitcoin? Not a very good choice.,The peso or #Bitcoin? Not a very good choice.,-0.3865,0.0,0.273,-0.26923076923076916,0.46153846153846156
2020-09-07,2,"  Not really. He's only 18. He does not have much money to blow on #Bitcoin, which is actually a very good thing. My concern is for older people who will lose a lot more, and who don't have enough years left to make back what the loss.","Not really. He's only 18. He does not have much money to blow on #Bitcoin, which is actually a very good thing. My concern is for older people who will lose a lot more, and who don't have enough years left to make back what the loss.",-0.204,0.064,0.1,0.22208333333333333,0.4141666666666667
2020-09-07,2,  All of my reasons for believing #Bitcoin will fail are good. You're just hoping it succeeds.,All of my reasons for believing #Bitcoin will fail are good. You're just hoping it succeeds.,0.6597,0.365,0.143,0.3,0.3333333333333333
2020-09-07,2, Not if you own #gold and #silver instead. They I'm short both U.S. dollars and #Bitcoin and long real money.,Not if you own #gold and #silver instead. They I'm short both U.S. dollars and #Bitcoin and long real money.,0.0,0.0,0.0,0.1875,0.5
2020-09-08,2,It should've been obvious that I was trolling with my poll. Those of you who fell for my publicity stunt should've used your time to sell your #Bitcoin and buy #gold. If you guys still need investment advice my 7-year-old son is free and my 4-year-old daughter has some ideas too.,It should've been obvious that I was trolling with my poll. Those of you who fell for my publicity stunt should've used your time to sell your #Bitcoin and buy #gold. If you guys still need investment advice my 7-year-old son is free and my 4-year-old daughter has some ideas too.,0.5106,0.063,0.0,0.2,0.65
2020-09-08,2,Despite a massive TV advertising blitz to pump the price the Grayscale Ethereum Trust just hit its lowest price since March and is down over 80% since its June high. This is likely a leading indicator for the more popular #Bitcoin Trust that was featured in the same campaign.,Despite a massive TV advertising blitz to pump the price the Grayscale Ethereum Trust just hit its lowest price since March and is down over 80% since its June high. This is likely a leading indicator for the more popular #Bitcoin Trust that was featured in the same campaign.,0.796,0.175,0.047,0.15777777777777777,0.621984126984127
2020-09-10,2,   Why us would I have worded it the way I did. I was begging Bitcoin guys to troll my poll. But in their eagerness to troll me they didn't realize that I was trolling them.  I have lots of real time text messages to prove that.,Why us would I have worded it the way I did. I was begging Bitcoin guys to troll my poll. But in their eagerness to troll me they didn't realize that I was trolling them.  I have lots of real time text messages to prove that.,0.4019,0.063,0.0,0.2,0.30000000000000004
2020-09-13,2," We never even receive the #Bitcoin. Bitpay converts it to dollars and then pays Schiff Gold in dollars, not Bitcoin.  So Bitpay accepts Bitcoin.  Not Schiff Gold.","We never even receive the #Bitcoin. Bitpay converts it to dollars and then pays Schiff Gold in dollars, not Bitcoin.  So Bitpay accepts Bitcoin.  Not Schiff Gold.",0.3774,0.09,0.0,0.0,0.0
2020-09-14,3,    What if I offer the prize money in #Bitcoin?  As I don't have any I will have to borrow some from  and buy the rest.,What if I offer the prize money in #Bitcoin?  As I don't have any I will have to borrow some from  and buy the rest.,0.5106,0.136,0.0,0.0,0.0
2020-09-14,3,     We can use #gold to make the trophy. Can't do that with #Bitcoin.,We can use #gold to make the trophy. Can't do that with #Bitcoin.,0.0,0.0,0.0,0.0,0.0
2020-09-14,3, I'm not being paid anything. Just doing my part to safeguard potential victims of the #Bitcoin pyramid scheme.,I'm not being paid anything. Just doing my part to safeguard potential victims of the #Bitcoin pyramid scheme.,0.0772,0.124,0.11,0.0,1.0
2020-10-08,6,  Unfortunately for Square shareholders the answer is none. They made the mistake of buying #Bitcoin instead.,Unfortunately for Square shareholders the answer is none. They made the mistake of buying #Bitcoin instead.,-0.5859,0.0,0.255,-0.5,1.0
2020-10-08,6,Bitcoin spiked 4% on news that Square invested $50 million (1% of total assets) into #Bitcoin. But that buying has already taken place. Speculators are betting the announcement will attract new buyers. The real news is Square's buying failed to push Bitcoin above its 2019 high.,Bitcoin spiked 4% on news that Square invested $50 million (1% of total assets) into #Bitcoin. But that buying has already taken place. Speculators are betting the announcement will attract new buyers. The real news is Square's buying failed to push Bitcoin above its 2019 high.,-0.2023,0.05,0.066,-0.0006060606060606053,0.40742424242424247
2020-10-08,6, Gold is a far larger market.  Aren't you curious who sold all the Bitcoin Square bought?,Gold is a far larger market.  Aren't you curious who sold all the Bitcoin Square bought?,-0.2411,0.0,0.123,0.0,0.8333333333333334
2020-10-08,6, Jack Dorsey is a long-time Bitcoin fan. So this is not likely the start of a new trend.,Jack Dorsey is a long-time Bitcoin fan. So this is not likely the start of a new trend.,0.3182,0.133,0.0,0.06818181818181818,0.7272727272727273
2020-10-08,6, They won't.  has been a vocal #Bitcoin fan for years. He is hardly a new convert. I don't see many other companies following his lead.,They won't.  has been a vocal #Bitcoin fan for years. He is hardly a new convert. I don't see many other companies following his lead.,0.3182,0.099,0.0,0.1278409090909091,0.35738636363636367
2020-10-28,9, Looks like a great time to sell #Bitcoin and buy #gold right on the upward sloping trend line.,Looks like a great time to sell #Bitcoin and buy #gold right on the upward sloping trend line.,0.765,0.306,0.0,0.5428571428571429,0.6428571428571428
2020-10-28,9,"If you measure the size of asset bubbles based on the level of conviction buyers have in their trade, the #Bitcoin bubble is the biggest I've seen. Bitcoin hodlers are more confident they're right and sure they can't lose than were dotcom or house buyers during those bubbles.","If you measure the size of asset bubbles based on the level of conviction buyers have in their trade, the #Bitcoin bubble is the biggest I've seen. Bitcoin hodlers are more confident they're right and sure they can't lose than were dotcom or house buyers during those bubbles.",0.8608,0.193,0.0,0.4464285714285714,0.689484126984127
2020-10-28,9,"  Bitcoin is down more than gold, so it was a good trade.  It's about to get even better.","Bitcoin is down more than gold, so it was a good trade.  It's about to get even better.",0.7239,0.288,0.0,0.38611111111111107,0.47222222222222227
2020-11-05,10," #Bitcoin is much too risky.  The price can crash at any moment.  I would much rather take risk buying #gold and #silver mining stocks. They are up about as much as Bitcoin today, but with much less risk.","#Bitcoin is much too risky.  The price can crash at any moment.  I would much rather take risk buying #gold and #silver mining stocks. They are up about as much as Bitcoin today, but with much less risk.",-0.6652,0.0,0.184,0.10833333333333336,0.16666666666666669
2020-11-05,10,   The problem is #Bitcoin is not sound money.,The problem is #Bitcoin is not sound money.,-0.4019,0.0,0.278,-0.2,0.4
2020-11-07,10,She's actually lose her shirt anyway if she doesn't sell her #Bitcoin.,She's actually lose her shirt anyway if she doesn't sell her #Bitcoin.,-0.4019,0.0,0.197,0.0,0.1
2020-11-14,11,  So what? #Bitcoin and #gold have nothing in common.  Lot's of other speculative assets are up big this month too. What does that have to do with the price of gold?,So what? #Bitcoin and #gold have nothing in common.  Lot's of other speculative assets are up big this month too. What does that have to do with the price of gold?,0.3527,0.107,0.0,-0.14166666666666666,0.325
2020-11-16,12,"The recent rise of Bitcoin relative to #gold in no way proves that #Bitcoin is a superior store of value. Exuberant investors are flocking to risk assets and shunning safe-havens world-wide. As the riskiest asset of them all, Bitcoin is being bought as part of the risk on-trade.","The recent rise of Bitcoin relative to #gold in no way proves that #Bitcoin is a superior store of value. Exuberant investors are flocking to risk assets and shunning safe-havens world-wide. As the riskiest asset of them all, Bitcoin is being bought as part of the risk on-trade.",0.7184,0.229,0.146,0.21000000000000002,0.41
2020-11-16,12,"Comparing the return on Bitcoin to return on gold is irrelevant, as #Bitcoin and #gold have nothing in common. They are not competing assets. It's like comparing the return on gold to the return on Tesla. During bubbles lots of assets beat gold. Gold wins once those bubbles pop.","Comparing the return on Bitcoin to return on gold is irrelevant, as #Bitcoin and #gold have nothing in common. They are not competing assets. It's like comparing the return on gold to the return on Tesla. During bubbles lots of assets beat gold. Gold wins once those bubbles pop.",0.6327,0.114,0.056,-0.16666666666666666,0.5666666666666667
2020-11-16,12, Now why would I want to do something that foolish?  You should let me know when you want to take profits on your fool's gold and buy the real thing. You need to do so before the supply of greater fools runs out. Don't get caught hodling #Bitcoin when the music stops playing.,Now why would I want to do something that foolish?  You should let me know when you want to take profits on your fool's gold and buy the real thing. You need to do so before the supply of greater fools runs out. Don't get caught hodling #Bitcoin when the music stops playing.,0.2263,0.161,0.114,0.35,0.4
2020-11-17,12," You will likely never know the answer to this question, as #Bitcoin is very unlikely to ever hit $100K.","You will likely never know the answer to this question, as #Bitcoin is very unlikely to ever hit $100K.",0.0,0.0,0.0,-0.325,0.825
2020-11-17,12,  Well I was wrong not to buy #Bitcoin only because I missed out on the opportunity to sell it to a greater fool.  But you are also wrong for being too foolish to sell.,Well I was wrong not to buy #Bitcoin only because I missed out on the opportunity to sell it to a greater fool.  But you are also wrong for being too foolish to sell.,-0.7184,0.169,0.306,-0.125,0.825
2020-11-18,12, This just shows that the mindless speculation is confined to the same small group of speculators.  Pyramid schemes need a large supply of new buyers to keep going. This shows #Bitcoin is not succeeding in attracting enough new buyers.,This just shows that the mindless speculation is confined to the same small group of speculators.  Pyramid schemes need a large supply of new buyers to keep going. This shows #Bitcoin is not succeeding in attracting enough new buyers.,-0.7954,0.0,0.188,0.0052875695732838525,0.4660946196660482
2020-11-18,12, Also if Google searches were hitting new highs you would be arguing how bullish this is for #Bitcoin as it proves that more people are adopting it.  Wider adoption is key to Bitcoin's potential success.,Also if Google searches were hitting new highs you would be arguing how bullish this is for #Bitcoin as it proves that more people are adopting it.  Wider adoption is key to Bitcoin's potential success.,0.1779,0.093,0.076,0.20606060606060606,0.49242424242424243
2020-11-18,12,"  Yes you can buy it on Paypal, but can't use it to pay for anything. All you can do is sell it on Paypal.  Big deal.  That doesn't make it a store of value or a medium of exchange. It just means you can speculate on Bitcoin in your Paypal account instead of on another platfrom.","Yes you can buy it on Paypal, but can't use it to pay for anything. All you can do is sell it on Paypal.  Big deal.  That doesn't make it a store of value or a medium of exchange. It just means you can speculate on Bitcoin in your Paypal account instead of on another platfrom.",0.5187,0.086,0.028,0.0,0.1
2020-11-19,12,   The #Bitcoin bubble never fully deflated. Once it does it will have far too many holes to ever reflate.,The #Bitcoin bubble never fully deflated. Once it does it will have far too many holes to ever reflate.,0.0,0.0,0.0,0.3,0.75
2020-11-19,12,   The Bitcoin bubble getting bigger didn't prove you wrong. It just suckered you in.  That's what bubbles do.,The Bitcoin bubble getting bigger didn't prove you wrong. It just suckered you in.  That's what bubbles do.,-0.1144,0.118,0.139,-0.25,0.7
2020-11-20,12,"Though this article is negative on #Bitcoin, the Fox Business interview featured is extremely positive, with  speaking very favorably about Bitcoin and seriously discussing the possibility of Bitcoin trading at $300K by next year. https://t.co/S02ih2nccP","Though this article is negative on #Bitcoin, the Fox Business interview featured is extremely positive, with  speaking very favorably about Bitcoin and seriously discussing the possibility of Bitcoin trading at $300K by next year.",0.3369,0.157,0.125,-0.04121212121212121,0.38242424242424244
2020-11-20,12," This guy knows nothing about gold, or what makes it sound money. He is neither buying #gold nor #Bitcoin. He also has no understand about the flawed nature of our current fiat based monetary system. His bullish comments on Bitcoin are based solely on the mania driving the bubble.","This guy knows nothing about gold, or what makes it sound money. He is neither buying #gold nor #Bitcoin. He also has no understand about the flawed nature of our current fiat based monetary system. His bullish comments on Bitcoin are based solely on the mania driving the bubble.",-0.296,0.0,0.044,-0.033333333333333326,0.43333333333333335
2020-11-20,12,"The Dutch tulip craze occurred almost 400 years ago, yet it's still the most often cited example of a financial bubble and the irrational exuberance that defines them. 400 years from now will #Bitcoin have replaced Tulip bulbs as history's greatest mania and most studied bubble?","The Dutch tulip craze occurred almost 400 years ago, yet it's still the most often cited example of a financial bubble and the irrational exuberance that defines them. 400 years from now will #Bitcoin have replaced Tulip bulbs as history's greatest mania and most studied bubble?",0.296,0.084,0.08,0.5,0.5
2020-11-20,12,"The vast majority of media coverage of #Bitcoin has been positive, even from reporters who are bullish on main-stream assets, and have complete confidence in fiat currencies and central banks. Even this rare example of a negative story is a bit sympathetic.https://t.co/xbGWi85DR6","The vast majority of media coverage of #Bitcoin has been positive, even from reporters who are bullish on main-stream assets, and have complete confidence in fiat currencies and central banks. Even this rare example of a negative story is a bit sympathetic.",0.5994,0.178,0.077,0.054545454545454536,0.5825757575757575
2020-11-21,12,"The idea that #Bitcoin's value comes from the past work required to validated the information encoded on the block chain is nonsense. If I work hard to dig a hole and then fill it back up with dirt, what value does my labor create? Effort that produces no value is worthless.","The idea that #Bitcoin's value comes from the past work required to validated the information encoded on the block chain is nonsense. If I work hard to dig a hole and then fill it back up with dirt, what value does my labor create? Effort that produces no value is worthless.",-0.5106,0.176,0.228,-0.3354166666666667,0.42291666666666666
2020-11-21,12,"Anyone buying Bitcoin in a PayPal account is trusting a third party to store their Bitcoin. This defeats the supposed advantage #Bitcoin has over #gold.  Paypal could just as easily custody gold, an actual store of value, and allow customers to sell their gold to pay for stuff.","Anyone buying Bitcoin in a PayPal account is trusting a third party to store their Bitcoin. This defeats the supposed advantage #Bitcoin has over #gold.  Paypal could just as easily custody gold, an actual store of value, and allow customers to sell their gold to pay for stuff.",0.8555,0.253,0.066,0.14444444444444446,0.3111111111111111
2020-11-21,12," Sorry to hear that. Try not to ride it all the way back down. Also, don't sell all of your gold, as one day you may not be able to afford to buy any back, especially if you go down with the Bitcoin ship.","Sorry to hear that. Try not to ride it all the way back down. Also, don't sell all of your gold, as one day you may not be able to afford to buy any back, especially if you go down with the Bitcoin ship.",-0.0772,0.0,0.029,-0.044444444444444446,0.4575396825396825
2020-11-23,13,"Since PayPal customers buying #Bitcoin in anticipation of using it to fund future purchases must sell Bitcoin to buy an actual currency to transact with merchants, today's buyers are tomorrows sellers. If speculative fever dies down, who will take the other side of those trades?","Since PayPal customers buying #Bitcoin in anticipation of using it to fund future purchases must sell Bitcoin to buy an actual currency to transact with merchants, today's buyers are tomorrows sellers. If speculative fever dies down, who will take the other side of those trades?",0.2023,0.061,0.0,-0.07013888888888889,0.22222222222222224
2020-11-23,13,"PayPal's foray into #Bitcoin is a gimmick designed to provide a short-term boost to Bitcoin's price. If PayPal really wanted to offer its customers an alternative and reliable long-term store of value, it could have allowed them to buy #gold and store it to fund future purchases.","PayPal's foray into #Bitcoin is a gimmick designed to provide a short-term boost to Bitcoin's price. If PayPal really wanted to offer its customers an alternative and reliable long-term store of value, it could have allowed them to buy #gold and store it to fund future purchases.",0.6249,0.106,0.0,0.1,0.1625
2020-11-23,13," No you can't. There are real buyers for #gold based on all the things gold is used for today and will be used for tomorrow. People buy bonds for interest, stocks for dividends, and real estate for rent. You only buy Bitcoin to sell to someone else who buys it for the same reason.","No you can't. There are real buyers for #gold based on all the things gold is used for today and will be used for tomorrow. People buy bonds for interest, stocks for dividends, and real estate for rent. You only buy Bitcoin to sell to someone else who buys it for the same reason.",0.2023,0.052,0.038,0.1,0.43125
2020-11-23,13,"If people in the Bitcoin community were honest, they would be condemning PayPal for its centralized Bitcoin storage program, not cheering it on. If you are going to trust a third-party to store your #Bitcoin, you might as well trust that same third party to store your #gold.","If people in the Bitcoin community were honest, they would be condemning PayPal for its centralized Bitcoin storage program, not cheering it on. If you are going to trust a third-party to store your #Bitcoin, you might as well trust that same third party to store your #gold.",0.9,0.252,0.046,0.19999999999999998,0.3416666666666666
2020-11-23,13,"Once a third party is introduced to store Bitcoin, it loses any perceived advantage it has over gold as a medium of exchange. With third party storage it's far easier and more efficient to use #gold as a payment method than it is to use #Bitcoin. Gold is money. Bitcoin is not.","Once a third party is introduced to store Bitcoin, it loses any perceived advantage it has over gold as a medium of exchange. With third party storage it's far easier and more efficient to use #gold as a payment method than it is to use #Bitcoin. Gold is money. Bitcoin is not.",0.8748,0.227,0.039,0.06000000000000001,0.32
2020-11-24,13," No, it's not. Other assets are not pyramid schemes. If no one buys your house it still provides you with shelter.  Or you can rent it out for income.  These are the type of comments that make it all the more obvious that people buying #Bitcoin are completely clueless.","No, it's not. Other assets are not pyramid schemes. If no one buys your house it still provides you with shelter.  Or you can rent it out for income.  These are the type of comments that make it all the more obvious that people buying #Bitcoin are completely clueless.",-0.7725,0.0,0.162,0.165625,0.44375
2020-11-24,13,"Large investors and institutions are still not worried about inflation, as evidenced by low bond yields. When they finally start to worry, they will buy #gold, not #Bitcoin. The main buyers of Bitcoin are small speculators and a few fund managers who are taking advantage of them.","Large investors and institutions are still not worried about inflation, as evidenced by low bond yields. When they finally start to worry, they will buy #gold, not #Bitcoin. The main buyers of Bitcoin are small speculators and a few fund managers who are taking advantage of them.",-0.276,0.076,0.098,-0.011507936507936514,0.426984126984127
