date,week,tweets,processed,nltk-compound,nltk-pos,nltk-neg,tb-polarity,tb-subjectivity
2020-09-01,1, Buy bitcoin,Buy bitcoin,0.0,0.0,0.0,0.0,0.0
2020-09-01,1,The U.S. dollar is becoming a shitcoin faster than ever imagined. #Bitcoin is the key to salvation. https://t.co/fMMStO9zIg,The U.S. dollar is becoming a shitcoin faster than ever imagined. #Bitcoin is the key to salvation.,0.0,0.0,0.0,0.225,0.925
2020-09-02,1,"A #Bitcoin hodler jetting to the moon 🚀
https://t.co/vf95scRj3W",A #Bitcoin hodler jetting to the moon 🚀,0.0,0.0,0.0,0.0,0.0
2020-09-02,1," Yep, bitcoin is your rocket ship out","Yep, bitcoin is your rocket ship out",0.296,0.268,0.0,0.0,0.0
2020-09-04,1,Software is eating the world and gold is on the menu. #Bitcoin,Software is eating the world and gold is on the menu. #Bitcoin,0.0,0.0,0.0,0.0,0.0
2020-09-04,1,"Congratulations to  for winning the #BitcoinBillionaires paperback challenge! Check out her very creative, 1-bitcoin-worthy submission! 👍🚀 https://t.co/nUjARRzc1k","Congratulations to  for winning the #BitcoinBillionaires paperback challenge! Check out her very creative, 1-bitcoin-worthy submission! 👍🚀",0.9077,0.488,0.0,0.71875,0.875
2020-09-05,1,We need #Bitcoin more than ever now,We need #Bitcoin more than ever now,0.0,0.0,0.0,0.5,0.5
2020-09-05,1,Remember when a #Bitcoin dip was well below 10k? Now bitcoin dips are comfortably above 10k. New baseline. Bitcoin is consolidating before its next breakout.,Remember when a #Bitcoin dip was well below 10k? Now bitcoin dips are comfortably above 10k. New baseline. Bitcoin is consolidating before its next breakout.,0.5994,0.182,0.0,0.04545454545454545,0.18484848484848485
2020-09-06,1,  You again. Do you ever get tired of BTC punishing you? I hope you haven't had shorts on over the last decade,You again. Do you ever get tired of BTC punishing you? I hope you haven't had shorts on over the last decade,-0.5574,0.106,0.237,-0.2,0.3833333333333333
2020-09-06,1,"  Too bad you missed the long from $0 to $12k. Best performing investment of the last decade.

No BTC hodler is stuck, the liquidity is large enough for even Satoshi to unwind a position. 

Hopefully you can get the help you need","Too bad you missed the long from $0 to $12k. Best performing investment of the last decade.No BTC hodler is stuck, the liquidity is large enough for even Satoshi to unwind a position. Hopefully you can get the help you need",0.1779,0.179,0.185,0.0773809523809524,0.39365079365079364
2020-09-07,2,#Bitcoin is the ultimate gateway drug,#Bitcoin is the ultimate gateway drug,0.0,0.0,0.0,0.0,1.0
2020-09-07,2,"If you don’t own #bitcoin right now, your position is long USD shitcoin and short bitcoin. Think about that for a moment.","If you don’t own #bitcoin right now, your position is long USD shitcoin and short bitcoin. Think about that for a moment.",0.0,0.0,0.0,0.2089285714285714,0.5589285714285713
2020-09-07,2,"  Appreciate the kind words. While reasonable minds can disagree w/r/t bitcoin and gold, we can both agree that hard, sound money is the best way to outrun the scourge of inflation.","Appreciate the kind words. While reasonable minds can disagree w/r/t bitcoin and gold, we can both agree that hard, sound money is the best way to outrun the scourge of inflation.",0.8689,0.306,0.096,0.38166666666666665,0.5483333333333332
2020-09-10,2,European Central Bank’s 🏦 money printer 🖨 will continue to go brrrrrr. #Bitcoin https://t.co/xH5EDnvyBO,European Central Bank’s 🏦 money printer 🖨 will continue to go brrrrrr. #Bitcoin,0.0,0.0,0.0,0.0,0.125
2020-09-10,2,"The European Central Bank’s refinancing rate is 0% and its deposit rate is -.5%. This means it is free to borrow money, but actually costs you money to save. 🤔 This is both a potent recipe for inflation and powerful advertisement for #Bitcoin","The European Central Bank’s refinancing rate is 0% and its deposit rate is -.5%. This means it is free to borrow money, but actually costs you money to save. 🤔 This is both a potent recipe for inflation and powerful advertisement for #Bitcoin",0.8793,0.211,0.0,0.19999999999999998,0.4416666666666667
2020-09-10,2,"3/3 Access to credit is foundational to building a better life. #Bitcoin, crypto, and #DeFi can help improve everyone's access to money.","3/3 Access to credit is foundational to building a better life. #Bitcoin, crypto, and #DeFi can help improve everyone's access to money.",0.8779,0.395,0.0,0.5,0.5
2020-09-10,2,China hustling to build up strategic goods and commodity reserves amid continued global uncertainty. I wonder if #Bitcoin is on the menu? Time will tell... https://t.co/zDHxTV2QsU,China hustling to build up strategic goods and commodity reserves amid continued global uncertainty. I wonder if #Bitcoin is on the menu? Time will tell...,-0.34,0.0,0.091,0.0,0.0
2020-09-11,2,When #Bitcoin takes over Hong Kong https://t.co/U0fEprF59c,When #Bitcoin takes over Hong Kong,0.0,0.0,0.0,0.0,0.0
2020-09-11,2,#Bitcoin is a global revolution and so is #BitcoinBillionaires now too! https://t.co/6P9nn4vBdm,#Bitcoin is a global revolution and so is #BitcoinBillionaires now too!,0.0,0.0,0.0,0.0,0.0
2020-09-12,2,When #Bitcoin takes over Hong Kong https://t.co/ZmunnAFQFi,When #Bitcoin takes over Hong Kong,0.0,0.0,0.0,0.0,0.0
2020-09-12,2,"Make sure to enlarge pic to read the disclaimer at the bottom: ""Your Bitcoin are your responsibility. There will be no bailouts or quantitative easing. Bitcoin transactions are irreversible. Not suitable for money laundering.""","Make sure to enlarge pic to read the disclaimer at the bottom: ""Your Bitcoin are your responsibility. There will be no bailouts or quantitative easing. Bitcoin transactions are irreversible. Not suitable for money laundering.""",0.0772,0.112,0.104,0.11249999999999999,0.8194444444444444
2020-09-13,2, The cynics are always the blindest. Everything looks like a cliche because they have yet to become capable of any deeper vision. The same people who missed bitcoin all these years.,The cynics are always the blindest. Everything looks like a cliche because they have yet to become capable of any deeper vision. The same people who missed bitcoin all these years.,0.5574,0.199,0.098,0.1,0.2625
2020-09-14,3,"We're about to see #Bitcoin square off against gold. In less than 24 hrs, $PAXG  - a crypto wrapped 1 fine troy ounce of gold, will be available for trading on !","We're about to see #Bitcoin square off against gold. In less than 24 hrs, $PAXG  - a crypto wrapped 1 fine troy ounce of gold, will be available for trading on !",0.2714,0.072,0.0,0.25,0.32222222222222224
2020-09-14,3,     Owning bitcoin and ether is even better,Owning bitcoin and ether is even better,0.4404,0.326,0.0,0.5,0.5
2020-09-15,3,"Another Wall Street legend,  is long #Bitcoin. Jim, Paul Tudor Jones, and so many other seasoned investors have figured out that it's your best protection against inflation. Booyah!

https://t.co/rUdyZgw7dT","Another Wall Street legend,  is long #Bitcoin. Jim, Paul Tudor Jones, and so many other seasoned investors have figured out that it's your best protection against inflation. Booyah!",0.6696,0.138,0.0,0.315,0.365
2020-09-15,3,"Publicly-traded company  is stacking sats! They now sit on 38,250 #Bitcoin in their treasury reserves. They understand that bitcoin will outrun the scourge of inflation.
https://t.co/U7i1uK7qfj","Publicly-traded company  is stacking sats! They now sit on 38,250 #Bitcoin in their treasury reserves. They understand that bitcoin will outrun the scourge of inflation.",0.2714,0.077,0.0,0.0,0.0
2020-09-15,3,"Rockstar legend and accomplished investor/businessman  is stacking sats! So many successful people are getting into #Bitcoin and Ether. If you're not, you gotta ask yourself, what do you know that , Gene, and Paul Tudor Jones don't. https://t.co/VPlMEc2oIU","Rockstar legend and accomplished investor/businessman  is stacking sats! So many successful people are getting into #Bitcoin and Ether. If you're not, you gotta ask yourself, what do you know that , Gene, and Paul Tudor Jones don't.",0.8058,0.172,0.0,0.5,0.65
2020-09-17,3,"Wow, the Bank of England discussing negative interest rates. If they adopt this, they would be paying you to borrow. You couldn’t buy a better advertisement for #Bitcoin but u can take their money and go long bitcoin 😂🚀 https://t.co/Bjdos2Ml2l","Wow, the Bank of England discussing negative interest rates. If they adopt this, they would be paying you to borrow. You couldn’t buy a better advertisement for #Bitcoin but u can take their money and go long bitcoin 😂🚀",0.5187,0.179,0.055,0.06250000000000001,0.575
2020-09-21,4,"#Bitcoin is better at being gold than gold — and not just incrementally, but by an order of magnitude or 10X better. https://t.co/rhKOQD44AZ","#Bitcoin is better at being gold than gold — and not just incrementally, but by an order of magnitude or 10X better.",0.7003,0.225,0.0,0.5,0.5
2020-09-21,4," I like it. Not as much as bitcoin, but I like it. It's a gold token, so it's a great hedge to all of the oncoming inflation.","I like it. Not as much as bitcoin, but I like it. It's a gold token, so it's a great hedge to all of the oncoming inflation.",0.9015,0.356,0.0,0.5,0.475
2020-09-26,4,When The Mechanical Hound in Fahrenheit 451 comes to life. What could go wrong? He probably accepts #Bitcoin though. https://t.co/oHrkf2wGIt,When The Mechanical Hound in Fahrenheit 451 comes to life. What could go wrong? He probably accepts #Bitcoin though.,-0.2023,0.098,0.132,-0.5,0.9
2020-09-29,5,"The KuCoin hack reminds us that decentralization is a spectrum. #Bitcoin is an example of extreme decentralization. Many DeFi projects are not there yet, but its a mistake to overly criticize them on one snapshot in time. Decentralization is a journey; many of them will get there","The KuCoin hack reminds us that decentralization is a spectrum. #Bitcoin is an example of extreme decentralization. Many DeFi projects are not there yet, but its a mistake to overly criticize them on one snapshot in time. Decentralization is a journey; many of them will get there",-0.7579,0.0,0.134,0.2916666666666667,0.6666666666666666
2020-09-29,5,Do it! You’re way too ahead of the curve not to. You get it. #Bitcoin https://t.co/Cx8YDqHioF,Do it! You’re way too ahead of the curve not to. You get it. #Bitcoin,0.0,0.0,0.0,0.0,0.0
2020-10-01,5,I've never been more bullish on #Bitcoin and ether,I've never been more bullish on #Bitcoin and ether,0.0,0.0,0.0,0.5,0.5
2020-10-03,5,When #Bitcoin meets Hamilton. Someone get this guy a Tony! https://t.co/utagAEsjKz,When #Bitcoin meets Hamilton. Someone get this guy a Tony!,0.0,0.0,0.0,0.0,0.0
2020-10-03,5,#Bitcoin is all about the Long Game,#Bitcoin is all about the Long Game,0.0,0.0,0.0,-0.225,0.4
2020-10-05,6,"#Bitcoin is still only owned by a small fraction of the early adopter crowd. The early majority, late majority, and laggards still haven't shown up yet. It's so early.","#Bitcoin is still only owned by a small fraction of the early adopter crowd. The early majority, late majority, and laggards still haven't shown up yet. It's so early.",0.0,0.0,0.0,-0.041666666666666664,0.48333333333333334
2020-10-05,6,"  This is not investment advice, but bitcoin and ether are great starting points","This is not investment advice, but bitcoin and ether are great starting points",0.7684,0.32,0.0,0.4,0.425
2020-10-06,6,"What's tragic is all the trust people have put into governments, the Fed, and ""leaders."" Years ago I decided to put my trust in math, instead. That's why I own #Bitcoin, ether, and whole slew of other cryptos. I've hedged my bets, not taking any chances. 
https://t.co/DZipeJX3lp","What's tragic is all the trust people have put into governments, the Fed, and ""leaders."" Years ago I decided to put my trust in math, instead. That's why I own #Bitcoin, ether, and whole slew of other cryptos. I've hedged my bets, not taking any chances.",0.4603,0.126,0.088,-0.018750000000000003,0.63125
2020-10-07,6,"Attention all Bitcoiners. As many of you know, we lost #Bitcoin legend Hal Finney to #ALS in 2014. Join me in signing this petition to bring AMX0035, an experimental combination of two existing drugs, to ALS patients ASAP. #wecantwait https://t.co/zSNl5L3zTT","Attention all Bitcoiners. As many of you know, we lost #Bitcoin legend Hal Finney to #ALS in 2014. Join me in signing this petition to bring AMX0035, an experimental combination of two existing drugs, to ALS patients ASAP. #wecantwait",-0.0258,0.052,0.054,0.3,0.45
2020-10-08,6,"It must be nice to be an airline CEO. You can recklessly engage in share buybacks to enrich yourself and when ur behavior catches up to u, np just tap the Fed &amp; taxpayers. Capitalism without consequences is not capitalism. Exit into #Bitcoin #Defi #crypto https://t.co/b6XAszEn79","It must be nice to be an airline CEO. You can recklessly engage in share buybacks to enrich yourself and when ur behavior catches up to u, np just tap the Fed &amp; taxpayers. Capitalism without consequences is not capitalism. Exit into #Bitcoin #Defi #crypto",0.8316,0.189,0.0,0.6,1.0
2020-10-08,6,"First, it was  and publicly traded  buying $425million of #Bitcoin. Today, it is  and  buying $50million of bitcoin. Tomorrow, it will be another visionary leader, and another, and another...the tsunami is coming https://t.co/MjF5z6u7ha","First, it was  and publicly traded  buying $425million of #Bitcoin. Today, it is  and  buying $50million of bitcoin. Tomorrow, it will be another visionary leader, and another, and another...the tsunami is coming",0.5267,0.096,0.0,0.125,0.19999999999999998
2020-10-08,6,"The CEO of #Bitcoin has been behaving recklessly lately. But it’s all good because he plays golf with all the miners, who over lunch have agreed to bail him out by forcing all Bitcoin users, who had nothing to do with this, to cough up some of their bitcoin to socialize the loss","The CEO of #Bitcoin has been behaving recklessly lately. But it’s all good because he plays golf with all the miners, who over lunch have agreed to bail him out by forcing all Bitcoin users, who had nothing to do with this, to cough up some of their bitcoin to socialize the loss",0.5719,0.12,0.039,0.19999999999999998,0.6000000000000001
2020-10-08,6,"Oh wait, my bad, I just confused Bitcoin with the airlines, bankers, and the Fed. Why would anyone tolerate this system? I don’t, I’ve opted out into #Bitcoin and crypto.","Oh wait, my bad, I just confused Bitcoin with the airlines, bankers, and the Fed. Why would anyone tolerate this system? I don’t, I’ve opted out into #Bitcoin and crypto.",-0.7003,0.0,0.182,-0.5499999999999999,0.6833333333333333
2020-10-08,6,"We need only 3,247 more signatures! It takes 5 seconds! 

Let's show the world the strength and solidarity of the #Bitcoin community. Let's go! https://t.co/eAj7l6j6FD","We need only 3,247 more signatures! It takes 5 seconds! Let's show the world the strength and solidarity of the #Bitcoin community. Let's go!",0.7412,0.222,0.0,0.48828125,0.75
2020-10-09,6,#Bitcoin gliding above 11k and looking real boring is the perfect way to go into the weekend,#Bitcoin gliding above 11k and looking real boring is the perfect way to go into the weekend,0.34,0.176,0.11,0.0,0.7000000000000001
2020-10-09,6,"Stonks love nothing more than wen the money printer goes brrrr like an A-10 warthog. It's full-fledged addiction that's not going to end until it has to. When that will happen is hard to predict, but what's certain is that #Bitcoin will b your only refuge. https://t.co/8ivInAcroP","Stonks love nothing more than wen the money printer goes brrrr like an A-10 warthog. It's full-fledged addiction that's not going to end until it has to. When that will happen is hard to predict, but what's certain is that #Bitcoin will b your only refuge.",0.7003,0.139,0.024,0.25376984126984126,0.685515873015873
2020-10-09,6,Breaking: White House is proposing a new $1.8 trillion dollar advertisement campaign for #Bitcoin. To the moon! https://t.co/SxDnomzRpu,Breaking: White House is proposing a new $1.8 trillion dollar advertisement campaign for #Bitcoin. To the moon!,0.0,0.0,0.0,0.08522727272727272,0.22727272727272727
2020-10-10,6,Email kicked off an information revolution. #Bitcoin and crypto are ushering in a money revolution. Don’t leave yourself behind.,Email kicked off an information revolution. #Bitcoin and crypto are ushering in a money revolution. Don’t leave yourself behind.,-0.0516,0.0,0.066,-0.4,0.7
2020-10-11,6,"Jeff Bezos' recalling raising money for Amazon: ""It took more than 50 meetings for me to raise $1 million from investors, and over the course of all those meetings, the most common question was, “What’s the internet?”

Sums up my early experiences telling people about #Bitcoin","Jeff Bezos' recalling raising money for Amazon: ""It took more than 50 meetings for me to raise $1 million from investors, and over the course of all those meetings, the most common question was, “What’s the internet?”Sums up my early experiences telling people about #Bitcoin",0.1779,0.036,0.0,0.19999999999999998,0.45
2020-10-13,7,#Bitcoin looking strong. Poised for a breakout bull run into the New Year.,#Bitcoin looking strong. Poised for a breakout bull run into the New Year.,0.6486,0.346,0.0,0.2848484848484848,0.5939393939393939
2020-10-13,7,#Bitcoin and crypto represent the self-actualization of money,#Bitcoin and crypto represent the self-actualization of money,0.0,0.0,0.0,0.0,0.0
2020-10-14,7,"Big News. Filecoin $FIL, the most anticipated crypto since the launch of Ethereum and #Bitcoin itself, is here! Tomorrow,  will support trading and custody for $FIL. Get ready! https://t.co/hs97Ogn0Bd","Big News. Filecoin $FIL, the most anticipated crypto since the launch of Ethereum and #Bitcoin itself, is here! Tomorrow,  will support trading and custody for $FIL. Get ready!",0.6988,0.176,0.0,0.2916666666666667,0.3666666666666667
2020-10-15,7,"Few understand this. But, It's only a matter of time before everyone eventually does. #Bitcoin 

https://t.co/mqbqVyaNwN","Few understand this. But, It's only a matter of time before everyone eventually does. #Bitcoin",0.0258,0.073,0.0,-0.1,0.55
2020-10-20,8,#Bitcoin quietly consolidating within striking distance of 12k. Love it,#Bitcoin quietly consolidating within striking distance of 12k. Love it,0.6369,0.318,0.0,0.3333333333333333,0.6444444444444444
2020-10-20,8,"If there ever was a time to own #Bitcoin, that time has come. Even before COVID-19, and despite the longest bull run in U.S. economic history, the government was spending money like a drunken sailor, cutting taxes like Crazy Eddie, and printing money like a banana republic.","If there ever was a time to own #Bitcoin, that time has come. Even before COVID-19, and despite the longest bull run in U.S. economic history, the government was spending money like a drunken sailor, cutting taxes like Crazy Eddie, and printing money like a banana republic.",0.5574,0.149,0.077,-0.09999999999999998,0.75
2020-10-21,8,"Big Milestone. The #Bitcoin Fund by  that trades publicly on the Toronto Stock Exchange under $QBTC.U, just passed the $100 million mark. Onward!","Big Milestone. The #Bitcoin Fund by  that trades publicly on the Toronto Stock Exchange under $QBTC.U, just passed the $100 million mark. Onward!",0.0,0.0,0.0,0.0,0.08333333333333334
2020-10-21,8,"#Bitcoin busts through 12k, 15k here we come!","#Bitcoin busts through 12k, 15k here we come!",0.0,0.0,0.0,0.0,0.0
2020-10-21,8,"#Bitcoin. Slowly, then suddenly...","#Bitcoin. Slowly, then suddenly...",0.0,0.0,0.0,-0.15000000000000002,0.44999999999999996
2020-10-21,8,"As people wake up to the fact that the US dollar is fast becoming toilet paper, they are also waking up to the fact that #Bitcoin is their only savior.","As people wake up to the fact that the US dollar is fast becoming toilet paper, they are also waking up to the fact that #Bitcoin is their only savior.",0.0,0.0,0.0,0.15416666666666667,0.6125
2020-10-21,8, What about when I was bullish at $8 dollar bitcoin?,What about when I was bullish at $8 dollar bitcoin?,0.0,0.0,0.0,0.0,0.0
2020-10-21,8,"The trade of the century is still available and completely out in the open. The next investors, companies, or countries that take $100 million or greater position in #Bitcoin &amp; talk about it, will go down in history as the greatest visionaries of this generation wen BTC hits 500k","The trade of the century is still available and completely out in the open. The next investors, companies, or countries that take $100 million or greater position in #Bitcoin &amp; talk about it, will go down in history as the greatest visionaries of this generation wen BTC hits 500k",0.7717,0.125,0.0,0.2634920634920635,0.4412698412698413
2020-10-21,8,$Bitcoin getting ready to knock of the moon's door,$Bitcoin getting ready to knock of the moon's door,0.3612,0.238,0.0,0.2,0.5
2020-10-21,8,And we’ve breached 13k #Bitcoin. Here we go 14k!,And we’ve breached 13k #Bitcoin. Here we go 14k!,0.0,0.0,0.0,0.0,0.0
2020-10-22,8,#Bitcoin is in the bottom of the first inning,#Bitcoin is in the bottom of the first inning,0.0,0.0,0.0,0.25,0.3333333333333333
2020-10-22,8,#Bitcoin just chilling above 13k and the week’s not even over yet,#Bitcoin just chilling above 13k and the week’s not even over yet,-0.0258,0.0,0.091,-0.25,0.5
2020-10-22,8,Legendary investor Paul Tudor Jones compares investing in #Bitcoin to investing with Steve Jobs and Apple. Smartest people in the room continue to buy bitcoin and extol its virtues. I have yet to hear one intelligent argument not to own BTC. Still waiting. https://t.co/uie0jjoUbG,Legendary investor Paul Tudor Jones compares investing in #Bitcoin to investing with Steve Jobs and Apple. Smartest people in the room continue to buy bitcoin and extol its virtues. I have yet to hear one intelligent argument not to own BTC. Still waiting.,0.7906,0.186,0.049,0.7999999999999999,0.9666666666666667
2020-10-23,8,"The U.S. dollar is no longer a reliable store of value.  and I make the case for $500K #Bitcoin with . Another engaging, wide-ranging discussion with Peter that covers a lot of ground. Food for the bulls. https://t.co/OTxBacRnYC","The U.S. dollar is no longer a reliable store of value.  and I make the case for $500K #Bitcoin with . Another engaging, wide-ranging discussion with Peter that covers a lot of ground. Food for the bulls.",0.3818,0.126,0.058,0.4,0.7
2020-10-26,9,"JP Morgan analysts think #Bitcoin could triple in value and challenge gold. While I think its at least like a 45x from here, not a 3x, at least we can agree that bitcoin is going up 🚀. It's hard to understand why anyone wouldn't own BTC by now. https://t.co/FurucyrVMV","JP Morgan analysts think #Bitcoin could triple in value and challenge gold. While I think its at least like a 45x from here, not a 3x, at least we can agree that bitcoin is going up 🚀. It's hard to understand why anyone wouldn't own BTC by now.",0.8331,0.213,0.027,-0.07291666666666666,0.5854166666666667
2020-10-27,9,"The most financially sophisticated people I know, who do not work in crypto, all have taken positions in #Bitcoin in the last 6 months. This quiet groundswell of demand is the reason bitcoin is on its way to 14k and beyond.","The most financially sophisticated people I know, who do not work in crypto, all have taken positions in #Bitcoin in the last 6 months. This quiet groundswell of demand is the reason bitcoin is on its way to 14k and beyond.",0.5233,0.092,0.035,0.25,0.475
2020-10-27,9,"I do think we will see an all-time-high price for #Bitcoin before 2020 is over. Even though the price has climbed from 10k to almost 14k in less than a month, it hasn't really gone on a breakout run yet. When we start to see 3-5k surges then the bulls will be on the run","I do think we will see an all-time-high price for #Bitcoin before 2020 is over. Even though the price has climbed from 10k to almost 14k in less than a month, it hasn't really gone on a breakout run yet. When we start to see 3-5k surges then the bulls will be on the run",0.0,0.0,0.0,0.016666666666666677,0.13333333333333333
2020-10-27,9,"Paul Tudor Jones, , , , , , and many more all have massive life success and #Bitcoin in common. If you don't own bitcoin right now, you have to ask yourself what exactly it is that you know and they don't.","Paul Tudor Jones, , , , , , and many more all have massive life success and #Bitcoin in common. If you don't own bitcoin right now, you have to ask yourself what exactly it is that you know and they don't.",0.5719,0.093,0.0,0.2669642857142857,0.5357142857142857
2020-10-28,9,"#Bitcoin roaring, but it's still 5K below it's all-time-high 3yrs ago. Party is just getting started 😂","#Bitcoin roaring, but it's still 5K below it's all-time-high 3yrs ago. Party is just getting started 😂",0.5499,0.191,0.0,0.0,0.0
2020-10-31,9,"#Bitcoin chilling at 13.5k and it's not even Halloween! Like I said before, this party hasn't even started 🚀👍😂👻","#Bitcoin chilling at 13.5k and it's not even Halloween! Like I said before, this party hasn't even started 🚀👍😂👻",0.2975,0.144,0.162,-0.625,0.9
2020-10-31,9,"#Bitcoin gliding above 13.5k and looking real boring is the perfect way to go into the weekend
https://t.co/czsirpyITK",#Bitcoin gliding above 13.5k and looking real boring is the perfect way to go into the weekend,0.34,0.168,0.105,0.0,0.7000000000000001
2020-11-02,10,"Both political parties are addicted to the Fed's money printer, so regardless of who wins the election, the only real, long-term winner will be #Bitcoin.","Both political parties are addicted to the Fed's money printer, so regardless of who wins the election, the only real, long-term winner will be #Bitcoin.",0.8807,0.317,0.0,0.019999999999999997,0.44000000000000006
